url,title,date,source,text
http://www.gxjjw.gov.cn/staticpages/20150724/gxjjw55b203b6-108070.shtml,百色市三举措严抓纪律审查,2015-07-24 17:21,百色市纪委,"今年来，百色市纪委深化ldquo三转rdquo，认真履行执纪、监督、问责职责，采取三举措严抓纪律审查工作。,实行领导包案制度,。一是加强对纪律审查的领导，纪委副书记直接参与纪律审查工作，分管纪检监察室。二是分管纪检监察室领导实行分片区包案制度；按照纪检监察室分片联系县（区）和职能部门的划分，各个分管常委加强对片区范围内案件线索排查初核的工作力度，对重大典型或疑难案件进行一线指导，从突破对象、文书制作等方面把关纪律审查案件质量。,实行纪律审查例会制度。,规定每周一上午召开纪律审查例会，纪委书记、副书记、分管纪检监察室的常委参加会议，根据内容，分层次、批次安排各个纪检监察室全体人员参加会议。各纪检监察室汇报上周完成情况，着重汇报在纪律审查任务执行过程中遇到的问题、困难，提出本周工作计划、纪律审查工作推进意见和建议。分管领导针对分管的纪律审查工作作分析、探讨和工作指导，共同研究协调解决问题的办法。要求参加例会的人员严格遵守保密纪律，做好相关材料的保管，要求用专用会议记录本，由专人负责记录和保管。,充分利用办案点突破违纪案件,。纪律审查办案点于今年初投入使用后，至目前已突破严重违纪案件6件6人，占市纪委自办案14件的43％。因涉嫌违法，5人被移送司法机关。在突破严重违纪案件的同时，注重抓好纪律审查的安全，多次召开常委会、纪检监察室务会、纪律审查工作会等各种会议加强对自治区纪委《关于进一步严明纪律 切实强化纪律审查安全工作的通知》文件的学习，强调纪律审查的安全。结合实际，不断完善办案点的安全预案制度等相关制度，并严格按照制度执行，规范办案点的管理。同时，加强陪护人员的培训力度，建立陪护人员人才库，确保纪律审查安全。,编辑：符劲"
http://www.gxjjw.gov.cn/staticpages/20150727/gxjjw55b5a315-108085.shtml,柳州市：“八个会”提升纪律审查精准度,2015-07-27 11:18,柳州市纪委,"柳州市纪委把执纪问责放在党风廉政建设的突出位置，要求办案人员ldquo八个会rdquo，把握执纪重点环节，不断提升纪律审查精准度。2015年以来，重点查办了市人防办主任成某和市水利局局长罗某等一系列大要案，同时也对一大批违规使用公车、公款旅游等违反ldquo四风rdquo问题进行处理，纪律审查工作实现既ldquo抓大要案rdquo又ldquo抓早抓小rdquo的新突破。,一会线索排查。,全面推行ldquo线索统管集中排查机制rdquo，实现ldquo三个转变rdquo，即：在线索收集上，由过去主要依靠信访举报获取线索转变为注重多渠道挖掘线索；在线索管理上，由过去重点关注同级党委管理干部转变为下管一级，对重点岗位的下一级领导干部重点排查；在线索办理上，由过去以批办、交办为主向批办、集体排查、受理相结合转变，不断提升纪律审查工作水平。,二会初核研判。,纪律审查过程中做好初核工作的关键是研判线索价值，在积极拓宽案源的同时，以是否具有可查性作为标准，办案人员借此找出ldquo关键事rdquo，以此将线索按照拟立案、初步核实、谈话函询、暂存和了结等五类办法分类处置，防止线索大量积压。,三会突破问题。,纪律审查过程中通过熟悉案情、掌握违纪人员的基本情况、了解与本案有关的政策法规，确定谈话范围、列出谈话提纲、选好谈话地点，约好谈话时间和注重谈话技巧等办法突出做好与违纪人员谈话工作，促使违纪人员如实交待问题，及时、顺利的查清案情，作出正确处理。,四是会固定证据。,纪律审查过程中采取灵活的方法和技巧，注重收集有错证据和无错证据，通过仔细的工作，消除阻力，抓住重点，在快速全面取证和固定证据上下功夫，抢时间、争主动，避免串供、藏匿和假证等情况发生，达到事半功倍的效果。,五会运用条规。,纪律审查过程中严格控制结案时限的同时，强化质量意识，坚持以质量促效率、以质量促提高。要求办案人员在工作中坚持严格审核、正确鉴别和使用法律条规，特别对疑难复杂案件，认真研究案情，仔细研读党纪政纪条规和解释，确保材料有理有据、定性量纪准确无误。,六会协调配合。,纪律审查过程中坚持ldquo四联rdquo办法，将办案资源优化组合，即：ldquo领导联片rdquo细化办案责任、ldquo线索联排rdquo防止案源流失、ldquo部门联查rdquo强化办案力度、ldquo上下联动rdquo优化办案力量。特别是注意与司法机关、行政执法机关保持协同办案的ldquo人和rdquo，多部门联合调查、协同作战、优势互补，提高效率。,七会分析报告。,纪律审查过程中注意做好案件剖析、总结和宣传的ldquo后一半rdquo工作：通过解剖案件，分析党员干部蜕变的思想轨迹和社会原因，为反腐倡廉提供生动、具体、有说服力的典型；通过总结办案人员斗智斗勇的经验，研究新形势下办案的规律性和对策，为在办案谋略与方法方面形成有价值的ldquo孙子兵法rdquo；通过宣传工作，及时发布案件阶段信息，发挥纪律审查应有的社会政治效果。,八会扩大战果。,纪律审查过程中通过分析个案的发案规律、内部联系，注重ldquo拔出萝卜带出泥rdquo，一旦撕开ldquo缺口rdquo就持续跟进，深挖细查，扩大战果，查处ldquo窝案、串案rdquo、ldquo案中案rdquo，办成ldquo精品案rdquo、ldquo系列案rdquo。,编辑：符劲"
http://www.gxjjw.gov.cn/staticpages/20150727/gxjjw55b607b5-108095.shtml,柳州市供销合作联社监事会副主任董泽元被调查,2015-07-27 18:28,自治区纪委案管室,"柳州市供销合作联社监事会副主任董泽元（副处）因涉嫌严重违纪，目前正接受组织调查。,编辑：杨意超"
http://www.gxjjw.gov.cn/staticpages/20150729/gxjjw55b887a1-108115.shtml,良庆区：纪律审查的“六个转变”,2015-07-29 15:58,良庆区纪委,"今年以来，良庆区纪委监察局为降低办案成本，快查快办案件，在办案方式和追责问责方面有很大的转变。,办案力量显著增强。,依据职能定位，抓紧做好机关内设机构调整工作，重点突出办案力量、强化监督力量、整合预防力量，将力量向办案一线倾斜。同时努力推进纪委派驻机构改革，力争做到有效整合力量、强化监督职能。,办案方向更加明确。,侧重查案方向，确保ldquo老虎rdquoldquo苍蝇rdquo一起打，特别是重点查处惠农补贴、违反中央八项规定精神、作风建设、重点领域的案件，今年上半年，共立案查办18件，结案15件，处分13人。,办案周期由长到短。,以往查处一起案件，从初核、立案调查、移送审理到结案，办案周期一般在50天以上乃至更长。今年以来，良庆区纪委监察局转变办案方式，以确保案件质效为出发点，要求一线办案人员扭转旧有的办案思维定位，真正突出主业、服务大局，将群众满意度作为衡量办案工作优劣的标准，大幅度缩短办案周期，提高办案效率。,问责力度从宽到严。,以往的案件，很少进行追责问责。但今年纪律审查时，严肃追责。今年以来共问责14人，特别是查处大沙田三个小学未经有关部门审批开办午托班，对落实主体责任不力的三个学校校长进行严肃查处，给予行政警告处分，并对教育局班子进行问责约谈。,提醒告知从无到有。,以往的案件，从未对被群众反映、经核实但不立案给予处分的领导干部进行告知提醒。但今年以来，良庆区纪委监察局以约谈的形式提醒当事人共21人/次，取得良好的效果。,公开通报点名道姓。,以往的案件，除个别典型案件外，一般很少公开通报，通报中涉及当事人一般用黄timetime、陈timetime表述，但今年以来，良庆区纪委监察局下发通报批评29人，均点名道姓公开曝光。,编辑：林小英"
http://www.gxjjw.gov.cn/staticpages/20150729/gxjjw55b88980-108116.shtml,天等县：“五快”工作法提高纪律审查效率,2015-07-29 16:06,天等县纪委,"今年以来，天等县纪委坚持把党纪挺在法律的前面，遵循五个ldquo快字诀rdquo，强化快查快结，切实提升纪律审查效率。,一是ldquo快联rdquo，即快速联动办案。整合检察、公安机关以及财政、审计、工商等执法单位的精干力量，形成联动办案合力。充实办案人才库，熟悉掌握办案人员的专业技能和特长，从而有针对性的选择办案人员，做到ldquo因案选人用人、查案快速有力rdquo。,二是ldquo快查rdquo，即快速查清问题。在规范问题线索处置的基础上，快速启动初核程序，紧紧把握案件线索关键点，深入实查，做到查实。对案情简单、违纪事实单一的案件，在核实主体身份后，深入展开外围调查取证；待违纪事实摸清以后，再接触被调查对象，以证促供，一举打开突破口；固定证据链，形成立案报告，提交县纪委常委会立案。,三是ldquo快审rdquo，快速审理介入。推行审理提前介入机制，根据案件的需要，随时召开常委会进行讨论或立案；在办理复杂案件时，经讨论确有必要时，在确保查审分离的前提下，调配熟悉案件审理工作人员熟悉案情，对证据进行把控，加快案件的查处进程，为快查快结快移奠定基础。,四是ldquo快结rdquo，快速办结案件。依据党章党规党纪进行纪律审查，快查快结、快进快出，把违反纪律的主要问题查清后，针对一些能够作出党纪政纪处分或者组织处理的问题，及时办理，尽快结案。,五是ldquo快移rdquo，快速移交司法。对案情复杂、涉嫌违法犯罪的案件，该县纪委只查清其主要的违纪违法事实或者查清其中一件涉嫌违法犯罪的事实后，就移交司法机关办理。,据了解，截至7月底，该县共立案查处违纪违法案件40件，同比增长33%。其中自办案件29件，涉农涉民生案件15件；涉案人员40人，涉及科级领导干部8人，其中正科级领导干部2人；给予党纪政纪处分,17人，移送司法机关10人；涉案总金额达248万元，挽回经济损失130余万元，收缴违纪款74.9万元，清退给群众违纪款7.4万元。,编辑：林小英"
http://www.gxjjw.gov.cn/staticpages/20150730/gxjjw55b999bb-108152.shtml,河池市民族事务委员会副主任银邦克接受组织调查,2015-07-30 11:27,自治区纪委案管室,"河池市民族事务委员会副主任银邦克（正处）因涉嫌严重违纪，目前正接受组织调查。,编辑：林小英"
http://www.gxjjw.gov.cn/staticpages/20150803/gxjjw55bee153-108232.shtml,河池市两名干部被“双开”,2015-08-03 11:34,自治区纪委,"河池市民政局原副局长蒙文生被开除党籍和公职,日前，经河池市委批准，河池市纪委对河池市民政局原党组成员、副局长蒙文生严重违纪违法问题进行立案审查。,经查，蒙文生严重违反组织纪律，对个人有关重大事项隐瞒不报；违规多占住房并在清理中未清退；利用职务上的便利，贪污公款，数额巨大；不正确履职，致矿产资源和生态环境遭到严重破坏；抵制组织审查。其中，贪污、滥用职权等问题涉嫌犯罪。,根据《中国共产党纪律处分条例》和《行政机关公务员处分条例》等规定，经河池市纪委审议并报河池市委批准，决定给予蒙文生开除党籍处分；经河池市监察局研究并报河池市人民政府批准，决定给予蒙文生开除公职处分，将其涉嫌犯罪问题及线索移送司法机关依法处理。,罗城仫佬族自治县原县委常委、统战部部长韦应勇被开除党籍和公职,日前，经河池市委批准，河池市纪委对罗城仫佬族自治县原县委常委、统战部部长韦应勇严重违纪违法问题进行了立案审查。,经查，韦应勇利用职务上的便利，贪污公款，情节严重。,韦应勇的上述行为已经严重违纪违法，并涉嫌犯罪。根据《中国共产党纪律处分条例》和参照《行政机关公务员处分条例》等规定，经河池市纪委审议并报河池市委批准，决定给予韦应勇开除党籍、开除公职处分；收缴其违纪所得。将其涉嫌犯罪问题及线索移送司法机关依法处理。,编辑：刘梦云"
http://www.gxjjw.gov.cn/staticpages/20150803/gxjjw55bee197-108233.shtml,钦州市供销合作联社副主任覃炎亨接受组织调查,2015-08-03 11:35,自治区纪委,"钦州市供销合作联社副主任覃炎亨（副处）因涉嫌严重违纪，目前正接受组织调查。,编辑：刘梦云"
http://www.gxjjw.gov.cn/staticpages/20150824/gxjjw55daef27-108468.shtml,广西新华书店集团原董事长黄健被双开,2015-08-24 18:17,自治区纪委,"日前，中共广西壮族自治区纪律检查委员会对广西新华书店集团股份有限公司党委书记、董事长黄健严重违纪违法问题进行了立案检查。,经查，黄健利用职务上的便利，为他人谋取利益，收受巨额财物；违规经商办企业；严重违反中央八项规定精神，多次在有关企业单位报销个人打高尔夫球费用；滥用职权，同意下属公司进行商业贿赂。,黄健的上述行为已构成严重违纪违法，其中受贿问题涉嫌犯罪。依据《中国共产党纪律处分条例》并参照《行政机关公务员处分条例》的有关规定，经中共广西壮族自治区纪律检查委员会审议并报中共广西壮族自治区委员会批准，决定给予黄健开除党籍、开除公职处分；将其涉嫌犯罪问题及线索移送司法机关依法处理。给予黄健开除公职处分由广西壮族自治区监察厅按程序报广西壮族自治区人民政府批准。,编辑：杨意超"
http://www.gxjjw.gov.cn/staticpages/20150828/gxjjw55dfdf24-108593.shtml,自治区安监局党组成员、副局长李仕庆接受组织调查,2015-08-28 12:10,,"自治区安全生产监督管理局党组成员、副局长李仕庆因涉嫌严重违纪，目前正接受组织调查。,李仕庆简历,李仕庆，男，汉族，1957年8月生，广西玉林人，1991年6月加入中国共产党，在职研究生学历，工学博士。1982年参加工作，1982年7月至1997年8月，任大厂矿务局助理工程师、工程师、车间副主任、主任，厂长助理、副厂长、厂长；1997年8月至2008年6月，任柳州华锡集团有限公司副总经理、总经理、董事、党委副书记；2008年6月至2013年4月，任广西有色金属集团有限公司董事、总经理、党委副书记；2013年4月至今，任自治区安全生产监督管理局党组成员、副局长。,编辑：林小英"
http://www.gxjjw.gov.cn/staticpages/20150907/gxjjw55ecf19f-108862.shtml,原广西合山矿务局局长谭光林被开除党籍,2015-09-07 10:08,来宾市纪委,"日前，来宾市纪委对原广西合山矿务局局长、广西合山煤业公司原董事长、总经理、党委书记谭光林严重违纪问题进行立案审查。,经查，谭光林利用职务上的便利，为他人谋取利益，收受他人财物，数额巨大。,谭光林的上述行为已严重违纪。来宾市纪委依照《中国共产党纪律处分条例》的有关规定，决定给予谭光林开除党籍处分，追缴其违纪所得，将其涉嫌犯罪问题及线索移送司法机关依法处理。,编辑：刘梦云"
http://www.gxjjw.gov.cn/staticpages/20150907/gxjjw55ed6142-108879.shtml,河池市民族事务委员会副主任银邦克被开除党籍和公职,2015-09-07 18:04,,"日前，经中共河池市委批准，中共河池市纪委对河池市民族事务委员会党组副书记、副主任银邦克严重违纪问题进行了立案审查。,经查，银邦克在担任罗城仫佬族自治县党委副书记、县长和河池市民族事务委员会党组副书记、副主任期间，严重违反政治纪律，不遵守政治规矩，干扰和阻挠组织决定；严重违反廉洁自律有关规定，收受下属及企业大额礼金、礼品；严重违反社会主义道德，与他人通奸；利用职务上的便利，为他人谋取利益，索取和收受他人巨额贿赂；滥用职权，违规设置合同条款和划拨工程预付款，给国家造成重大损失。其中,受贿、滥用职权涉嫌犯罪。,银邦克身为党员领导干部，无视党的政治纪律和政治规矩，严重违纪违法，且在党的十八大后仍不收敛、不收手，性质恶劣、情节严重。根据《中国共产党纪律处分条例》等有关规定，经中共河池市纪委、市监察局审议并报中共河池市委、市政府同意，决定给予银邦克开除党籍、开除公职处分，将其涉嫌犯罪问题及线索移送司法机关依法处理。,编辑：杨意超"
http://www.gxjjw.gov.cn/staticpages/20150908/gxjjw55ee965f-108908.shtml,德保县委原书记谢德强严重违纪违法被“双开”,2015-09-08 16:03,自治区纪委,"中共百色市委原委员、德保县委原书记谢德强,严重违纪违法被开除党籍和公职,日前，中共广西壮族自治区纪律检查委员会对中共百色市委原委员、德保县委原书记谢德强严重违纪违法问题进行了立案审查。,经查，谢德强违反廉洁自律规定，接受礼金；利用职务上的便利，收受巨额贿赂，在干部选拔任用、企业经营等方面为他人谋取利益；严重违反社会主义道德，与他人通奸。,谢德强身为党员领导干部，无视党的政治规矩和组织纪律，严重违纪违法，且在党的十八大后仍不收敛、不收手，情节严重，其中受贿问题涉嫌犯罪。依据《中国共产党纪律处分条例》和参照《行政机关公务员处分条例》的有关规定，经中共广西壮族自治区纪律检查委员会审议并报中共广西壮族自治区委员会批准，决定给予谢德强开除党籍、开除公职处分；将其涉嫌犯罪问题及线索移送司法机关依法处理。,编辑：林小英"
http://www.gxjjw.gov.cn/staticpages/20150517/gxjjw5558228d-103485.shtml,桂林市人民政府副秘书长邓晓斌严重违纪违法被“双开”,2015-05-17 13:09,桂林明镜网,"日前，桂林市纪委对桂林市人民政府副秘书长邓晓斌严重违纪违法问题进行立案审查。,经查，邓晓斌严重违反社会主义道德纪律，与他人通奸；违反廉洁自律规定，收受礼金、非法占有；利用职务上的便利，为他人谋取利益，收受巨额贿赂。,邓晓斌的上述行为已经构成严重违纪违法，并涉嫌犯罪。根据《中国共产党纪律处分条例》等有关规定，经桂林市纪委审议并报桂林市委批准，决定给予邓晓斌开除党籍和开除公职处分；将其涉嫌犯罪问题及线索，移送司法机关依法处理。（桂林市纪委）,编辑：林小英"
http://www.gxjjw.gov.cn/staticpages/20150518/gxjjw5559b704-103133.shtml,自治区人大财政经济委员会原副主任委员唐成良被调查,2015-05-18 17:55,广西纪检监察网,"广西壮族自治区人大财政经济委员会原副主任委员唐成良涉嫌严重违纪，目前正接受组织调查。,唐成良简历,唐成良，男，汉族，1951年12月生，湖南邵阳人，1974年12月加入中国共产党，1969年2月参加工作，在职研究生学历，其主要简历：,1998.07mdah2000.07 任钦州市副市长；,2000.07mdah2004.06 任北海市委常委、常务副市长；,2004.06mdah2006.08 任北海市委副书记、市长；,2006.08mdah2010.03 任贵港市委副书记、市长；,2010.03mdah2011.09 任自治区工业和信息化委员会党组书记；,2011.09mdah2015.04 任自治区人大财政经济委员会副主任委员。,编辑：林小英"
http://www.gxjjw.gov.cn/staticpages/20150519/gxjjw555aa1fd-103134.shtml,北海市规划局原党组书记、局长杨立志接受组织调查,2015-05-19 10:37,自治区纪委案管室,"北海市规划局原党组书记、局长杨立志因涉嫌严重违纪，目前正接受组织调查。,编辑：符劲"
http://www.gxjjw.gov.cn/staticpages/20150519/gxjjw555aa204-103135.shtml,广西北海渔业基地管理处党支部书记、处长赖祖平接受组织调查,2015-05-19 10:37,自治区纪委案管室,"广西北海渔业基地管理处党支部书记、处长赖祖平因涉嫌严重违纪，目前正接受组织调查。,编辑：杨意超"
http://www.gxjjw.gov.cn/staticpages/20150521/gxjjw555dab07-103136.shtml,百色市德保县委书记谢德强接受组织调查,2015-05-21 17:53,自治区纪委,"百色市委委员、德保县委书记谢德强涉嫌严重违纪，目前正接受组织调查。,谢德强简历,谢德强，男，汉族，1963年3月出生，广西陆川人，1991年5月加入中国共产党，1984年7月参加工作，大学学历，其主要简历：,1998.09mdah2002.05 任百色市隆林各族自治县委常委、组织部部长；,2002.05mdah2006.07 任百色市隆林各族自治县委副书记；,2006.07mdah2011.06 任百色市西林县委书记；,2011.06至今任百色市委委员、德保县委书记。,编辑：林小英"
http://www.gxjjw.gov.cn/staticpages/20150521/gxjjw555db34c-103137.shtml,自治区纪委第二纪检监察室原副主任施锦东严重违纪违法被双开,2015-05-21 18:28,广西纪检监察网,"日前，中共广西壮族自治区纪律检查委员会对本委第二纪检监察室原副主任施锦东严重违纪违法问题进行了立案检查。,经查，施锦东利用职务上的便利，为他人谋取利益，收受巨额财物。,施锦东的上述行为已经构成严重违纪违法，并涉嫌犯罪。依据《中国共产党纪律处分条例》、《行政机关公务员处分条例》的有关规定，经中共广西壮族自治区纪律检查委员会、广西壮族自治区监察厅审议，决定给予施锦东开除党籍、开除公职处分；将其涉嫌犯罪问题及线索移送司法机关依法处理。,编辑：杨意超"
http://www.gxjjw.gov.cn/staticpages/20150525/gxjjw5562dc53-103407.shtml,桂林市安监局原局长谢彬涉嫌严重违纪接受组织调查,2015-05-25 16:24,桂林明镜网,"桂林市安全生产监督管理局原局长谢彬因涉嫌严重违纪，目前正接受组织调查。（桂林市纪委）,编辑：林小英"
http://www.gxjjw.gov.cn/staticpages/20150526/gxjjw55640788-103138.shtml,自治区司法厅原副厅长梁振林严重违纪违法被“双开”,2015-05-26 13:41,广西纪检监察网,"日前，经中共广西壮族自治区委员会批准，中共广西壮族自治区纪律检查委员会对广西壮族自治区司法厅原党委委员、副厅长梁振林严重违纪问题进行了立案审查。,经查，梁振林利用职务上的便利，收受贿赂，为他人谋取利益；玩忽职守，造成恶劣的社会影响；妨害社会管理秩序，非法持有弹药；违反社会主义道德，与他人通奸。,梁振林身为党员领导干部，无视党的纪律，严重违纪违法，其中，受贿、玩忽职守、非法持有弹药问题涉嫌犯罪。依据《中国共产党纪律处分条例》和《行政机关公务员处分条例》有关规定，经中共广西壮族自治区纪律检查委员会审议并报中共广西壮族自治区委员会批准，决定给予梁振林开除党籍、开除公职处分，将其涉嫌犯罪问题及线索移送司法机关依法处理。给予梁振林开除公职处分由广西壮族自治区监察厅按程序报广西壮族自治区人民政府批准。,编辑：林小英"
http://www.gxjjw.gov.cn/staticpages/20150526/gxjjw556407c4-103139.shtml,自治区人防办原纪检组组长曾爱东严重违纪违法被“双开”,2015-05-26 13:42,广西纪检监察网,"日前，经中共广西壮族自治区委员会批准，中共广西壮族自治区纪律检查委员会对广西壮族自治区人民防空办公室原党组成员、纪检组组长曾爱东严重违纪问题进行了立案审查。,经查，曾爱东利用职务上的便利，为他人谋取利益，收受贿赂；玩忽职守，造成恶劣的社会影响。,曾爱东的上述行为已经构成严重违纪违法，并涉嫌犯罪。依据《中国共产党纪律处分条例》、《行政机关公务员处分条例》的有关规定，经中共广西壮族自治区纪律检查委员会审议并报中共广西壮族自治区委员会批准，决定给予曾爱东开除党籍、开除公职处分，将其涉嫌犯罪问题及线索移送司法机关依法处理。,编辑：林小英"
