url,title,date,source,text
http://www.gxjjw.gov.cn/staticpages/20161213/gxjjw584f4d87-120786.shtml,桂林市两名党员干部涉嫌严重违纪接受组织调查,2016-12-13 09:23,桂林市纪委,"据桂林市纪委消息：桂林市临桂区财政局原党组书记李国雄、临桂区环境保护局原局长李章娥因涉嫌严重违纪接受组织调查。,桂林市临桂区财政局原党组书记李国雄因涉嫌严重违纪，目前正接受组织调查。,李国雄简历,李国雄，男，汉族，1958年9月生，广西临桂人，大专文化，1978年4月加入中国共产党，1980年7月参加工作。1999年2月至2007年1月任临桂县民政局党组副书记、局长；2007年1月至2010年2月任临桂县交通局党组副书记、局长；2010年2月至2010年11月任临桂县卫生局党组书记；2010年11月至2013年11月任临桂县财政局党组书记；2013年11月至2015年5月任临桂县财政局主任科员；2015年5月至今任临桂区财政局主任科员[2010年5月至今兼任临桂县桂三高速公路建设协调工作领导小组办公室常务副主任（主持工作）]。,桂林市临桂区环境保护局原局长李章娥因涉嫌严重违纪，目前正接受组织调查。,李章娥简历,李章娥，女，汉族，1966年9月出生，广西临桂人，在职研究生学历，1998年1月加入中国共产党，1988年8月参加工作。2002年12月至2008年2月任临桂县建设局党组书记、副局长；2008年2月至2012年6月任临桂县建设局党组副书记、局长；2012年6月至2015年5月任临桂县环境保护局局长；2015年5月至2016年11月任临桂区环境保护局局长；2016年11月至今任临桂区政协主任科员。,编辑：刘梦云"
http://www.gxjjw.gov.cn/staticpages/20161215/gxjjw58520f4f-120831.shtml,广西柳州国家粮食储备库副主任莫革英被开除党籍,2016-12-15 11:34,柳州市纪委,"据柳州市纪委消息，日前，柳州市纪委对广西柳州国家粮食储备库党委委员、副主任莫革英严重违纪问题进行立案审查。,经查，莫革英在担任广西柳州国家粮食储备库党委委员、副主任期间，严重违反廉洁纪律，且在十八大后仍不收敛、不收手，为谋取单位利益，收受业务相关单位给予的巨额款项，并从中领取钱款，同时还违规收受其他与粮库有业务往来人员给予的礼金；违反工作纪律，在分管单位财务工作期间，不认真履行监管职责，对单位财务人员长期挪用巨额公款，给单位造成严重后果负有主要领导责任。其中为谋取单位利益，收受他人财物的行为已涉嫌犯罪。,莫革英身为国有企业党员领导干部，理想信念丧失，严重违反党的纪律，情节严重。依据《中国共产党纪律处分条例》等有关规定，经柳州市纪委研究决定，给予莫革英开除党籍处分；按照干部管理权限，由广西壮族自治区粮食局给予其行政处分；其涉嫌犯罪问题线索已移送司法机关依法处理。,编辑：刘梦云"
http://www.gxjjw.gov.cn/staticpages/20161216/gxjjw5853416a-120859.shtml,北海市3名处级干部被立案审查,2016-12-16 09:20,北海市纪委,"据北海市纪委消息：日前，经北海市委同意，北海市纪委对北海市水产畜牧兽医局党组成员、副局长周宏禹，北海市农业局党组成员、副局长徐良，北海市农业局副调研员薛万春的违纪问题进行立案审查。,编辑：刘梦云"
http://www.gxjjw.gov.cn/staticpages/20160909/gxjjw57d27482-118428.shtml,柳州市现代农业投资公司总经理、董事文军被立案审查,2016-09-09 16:36,柳州市纪委,"据柳州市纪委消息：日前，经柳州市委批准，柳州市纪委对柳州市现代农业投资公司总经理、董事文军的严重违纪问题进行立案审查。,编辑：刘梦云"
http://www.gxjjw.gov.cn/staticpages/20160909/gxjjw57d27dc6-118434.shtml,广西金融投资集团党委原副书记、原副总经理刘忠严重违纪被开除党籍和公职,2016-09-09 17:15,自治区纪委,"日前，中共广西壮族自治区纪律检查委员会对广西金融投资集团党委副书记、副总经理刘忠严重违纪问题进行了立案审查。,经查，刘忠利用担任柳州银行党委书记、董事长的职务之便，为他人谋取利益并收受巨额财物；违规收受下属礼金。不正确履行职责，违规给有关企业发放巨额贷款，使柳州银行造成重大损失。其中，利用职务之便为他人谋取利益并收受巨额财物、不正确履行职责问题涉嫌犯罪。,刘忠身为党员领导干部，理想信念丧失，严重违反党的纪律。根据《中国共产党纪律处分条例》等有关规定，经中共广西壮族自治区纪律检查委员会审议并报中共广西壮族自治区委员会批准，决定给予刘忠开除党籍、开除公职处分；收缴其违纪所得；将其涉嫌犯罪问题及线索移送司法机关依法处理。给予刘忠开除公职处分由广西壮族自治区监察厅按程序报广西壮族自治区人民政府批准。,编辑：刘梦云"
http://www.gxjjw.gov.cn/staticpages/20160912/gxjjw57d65c48-118458.shtml,桂林市七星区人民法院原院长裴邕被开除党籍,2016-09-12 15:42,桂林市纪委,"据桂林市纪委消息：日前，中共桂林市纪律检查委员会对桂林市七星区人民法院原院长裴邕进行了立案审查。,经查，裴邕违反廉洁纪律，收受礼金；利用职务之便，为他人谋取利益并收受财物，涉嫌受贿犯罪。,裴邕身为政法系统党员领导干部，严重违反党的纪律，执法犯法，情节严重。依据《中国共产党纪律处分条例》的相关规定，经中共桂林市纪律检查委员会审议并报中共桂林市委员会批准，决定给予裴邕开除党籍处分；将其涉嫌犯罪问题及线索移送司法机关依法处理。,编辑：林小英"
http://www.gxjjw.gov.cn/staticpages/20160912/gxjjw57d65c93-118457.shtml,桂林市公安局原调研员孙书庚被开除党籍,2016-09-12 15:43,桂林市纪委,"据桂林市纪委消息：日前，经中共桂林市委员会批准，中共桂林市纪律检查委员会对桂林市公安局原调研员孙书庚进行了立案审查。,经查，孙书庚利用职务上的便利为他人谋取利益，以入干股形式收受他人财物，涉嫌受贿犯罪。,孙书庚身为党员领导干部，严重违反党的纪律，性质恶劣，情节严重。依据《中国共产党纪律处分条例》的相关规定，经中共桂林市纪律检查委员会审议并报中共桂林市委员会批准，决定给予孙书庚开除党籍处分；其涉嫌犯罪问题及线索由司法机关依法处理。,编辑：杨意超"
http://www.gxjjw.gov.cn/staticpages/20160912/gxjjw57d65d2f-118459.shtml,桂林市公安局原调研员唐笔被开除党籍,2016-09-12 15:45,桂林市纪委,"据桂林市纪委消息： 日前，经中共桂林市委员会批准，中共桂林市纪律检查委员会对桂林市公安局原调研员唐笔进行了立案审查。,经查，唐笔利用职务上的便利为他人谋取利益，以入干股形式收受他人财物，涉嫌受贿犯罪。,唐笔身为党员领导干部，严重违反党的纪律，性质恶劣，情节严重。依据《中国共产党纪律处分条例》的相关规定，经中共桂林市纪律检查委员会审议并报中共桂林市委员会批准，决定给予唐笔开除党籍处分；其涉嫌犯罪问题及线索由司法机关依法处理。,编辑：杨意超"
http://www.gxjjw.gov.cn/staticpages/20160913/gxjjw57d75db8-118487.shtml,柳州银行两中层管理人员因严重违纪被开除党籍,2016-09-13 10:00,柳州市纪委,"据柳州市纪委消息：日前，柳州市纪委对柳州银行资产保全部原高级经理陈文、陈小汕两人严重违纪问题进行立案审查。,经查，陈文、陈小汕分别在担任柳州银行首席风险官、风险管理部总经理等职务期间，严重违反廉洁纪律，利用职务上的便利，为他人谋利并收受财物等行为；违反工作纪律，不认真履行贷款审核和风险管控职责，致使巨额贷款到期后无法回收，造成严重不良影响。,陈文、陈小汕身为中共党员、国企中层管理人员，理想信念丧失，严重违反党的纪律，情节严重。依据《中国共产党纪律处分条例》的有关规定，经市纪委常委会决定，分别给予陈文、陈小汕开除党籍处分，违纪款没收上缴国库。,编辑：刘梦云"
http://www.gxjjw.gov.cn/staticpages/20160918/gxjjw57de6169-118554.shtml,桂林市园林局原党组成员罗奇志被开除党籍、行政撤职,2016-09-18 17:42,桂林市纪委,"日前，中共桂林市纪律检查委员会对桂林市园林局原党组成员罗奇志进行了立案审查。,经查，罗奇志违反组织纪律，在干部考察任用中收受他人财物；违反廉洁纪律，利用职务之便，为他人谋取利益并收受财物。,罗奇志身为党员领导干部，违反党的纪律。依据《中国共产党纪律处分条例》的相关规定，经中共桂林市纪律检查委员会审议并报中共桂林市委员会批准，决定给予罗奇志开除党籍、行政撤职处分，按科员安排工作。,编辑：杨意超"
http://www.gxjjw.gov.cn/staticpages/20160918/gxjjw57de6181-118556.shtml,桂林市水库移民局原局长邓热和被开除党籍、行政撤职,2016-09-18 17:42,桂林市纪委,"日前，经中共桂林市委员会批准，中共桂林市纪律检查委员会对桂林市水库移民局原局长邓热和进行了立案审查。,经查，邓热和违反中央八项规定精神，违规发放津补贴，用公款赠送红包礼金；违反廉洁纪律，违规占用公物归个人使用，利用职务之便，报销个人费用；违反工作纪律，工作失职，造成工作经费损失。,邓热和身为党员领导干部，违反党的纪律。依据《中国共产党纪律处分条例》的相关规定，经中共桂林市纪律检查委员会审议并报中共桂林市委员会批准，决定给予邓热和开除党籍、行政撤职处分，按副主任科员安排工作。,编辑：杨意超"
http://www.gxjjw.gov.cn/staticpages/20160920/gxjjw57e0ef3f-118626.shtml,百色市隆林县人大常委会原副主任王翰庭接受组织调查,2016-09-20 16:11,百色市纪委,"据百色市纪委消息：百色市隆林各族自治县人大常委会原副主任王翰庭因涉嫌严重违纪，目前正接受组织调查。,王翰庭简历,王翰庭，男，壮族，广西隆林各族自治县人，1967年5月出生，中共党员，大学学历，1998年6月加入中国共产党，1989年7月参加工作。2007年3月至2011年7月，任隆林各族自治县发展和改革局党组书记、局长；2011年7月至2014年1月，任隆林各族自治县财政局党组副书记、局长；2014年1月至2014年3月，任隆林各族自治县人大常委会党组成员、财政局局长；2014年3月至2016年8月，任隆林各族自治县人大常委会党组成员、副主任；2016年8月至今，任隆林各族自治县副处级干部。,编辑：林小英"
http://www.gxjjw.gov.cn/staticpages/20160921/gxjjw57e24ba2-118640.shtml,北海市合浦县住房和城乡规划建设局党组书记、局长王异佳接受组织调查,2016-09-21 16:58,北海市纪委,"据北海市纪委消息：北海市合浦县住房和城乡规划建设局党组书记、局长王异佳涉嫌严重违纪，目前正接受组织调查。,编辑：林小英"
http://www.gxjjw.gov.cn/staticpages/20160928/gxjjw57eb1c2e-118808.shtml,桂林市临桂区委原常委、政法委书记雷志刚接受组织调查,2016-09-28 09:26,桂林市纪委,"据桂林市纪委消息：桂林市临桂区委原常委、政法委书记雷志刚因涉嫌严重违纪，目前正接受组织调查。,雷志刚简历：,雷志刚，男，汉族，1966年12月出生，广西永福县人，大学文化，1985年7月参加工作，1990年7月加入中国共产党。2004年8月至2006年8月任临桂县委常委、县委办主任；2006年8月至2015年5月任临桂县委常委、政法委书记；2015年5月至2016年5月任临桂区委常委、政法委书记。,编辑：林小英"
http://www.gxjjw.gov.cn/staticpages/20160929/gxjjw57ec89a7-118889.shtml,河池市凤山县凤旁林场原场长吴显军严重违纪被双开,2016-09-29 11:25,河池市纪委,"据河池市纪委消息：日前，中共河池市纪委对凤山县凤旁林场原场长吴显军（副处长级）进行了立案审查。,经查，吴显军故意违反国家对林业用油补贴资金的申报要求，指使财会人员采取虚报加大林场用油等方式，骗取国家林业用油补贴，造成国家专项资金损失，数额巨大，情节特别严重；利用职务上的便利，收受他人财物，数额巨大。,吴显军身为党员领导干部，理想信念丧失，严重违反党的纪律和国家法律,性质恶劣，情节严重。根据《中国共产党纪律处分条例》、《事业单位工作人员处分暂行规定》等有关规定，经中共河池市纪委常委会研究并报河池市委批准，决定给予吴显军开除党籍处分经河池市监察局长办公会研究并报河池市人民政府批准，决定给予吴显军开除公职处分；其涉嫌犯罪问题及线索由司法机关依法处理。,编辑：林小英"
http://www.gxjjw.gov.cn/staticpages/20160929/gxjjw57ecc2b1-118905.shtml,广西壮族自治区政协常委、经济委员会主任连友农严重违纪被开除党籍和公职,2016-09-29 15:28,自治区纪委,"日前，经中共广西壮族自治区委员会批准，中共广西壮族自治区纪律检查委员会对自治区政协常委、自治区政协经济委员会主任连友农严重违纪问题进行了立案审查。,经查，连友农违反中央八项规定精神，公车私用；违反组织纪律，不按规定如实报告个人有关事项，利用职务上便利在干部选拔任用中为他人谋取利益并收受财物；违反廉洁纪律，利用职务上的便利在企业经营方面为他人谋取利益并收受财物，用公款报销个人费用，收受礼金，虚报冒领差旅费；违反生活纪律，与他人发生不正当性关系，并非婚生育子女。其中，利用职务上的便利为他人谋取利益并收受财物，涉嫌犯罪。,连友农身为党员领导干部，理想信念丧失，严重违反党的纪律，性质恶劣、情节严重。依据《中国共产党纪律处分条例》等有关规定，经中共广西壮族自治区纪律检查委员会审议并报中共广西壮族自治区委员会批准，决定给予连友农开除党籍、开除公职处分；将其涉嫌犯罪问题及线索移送司法机关依法处理。,编辑：林小英"
http://www.gxjjw.gov.cn/staticpages/20160930/gxjjw57ee2a26-118958.shtml,罗城仫佬族自治县统计局党组书记、局长谢崇军被双开,2016-09-30 17:02,河池市纪委,"据河池市纪委消息：近日，中共河池市纪委对罗城仫佬族自治县统计局党组书记、局长谢崇军严重违纪问题进行立案审查。,经查，谢崇军严重违反廉洁纪律，利用职务便利，私自承揽工程项目并获取利益，情节严重；与他人合谋虚报工程量套取国家工程款并进行私分，涉嫌犯罪。,根据《中国共产党纪律处分条例》以及《行政机关公务员处分条例》的有关规定，经中共河池市纪委常委会、河池市监察局局长办公会审议，决定给予谢崇军开除党籍、开除公职处分。其涉嫌犯罪问题及线索移送司法机关依法处理。,编辑：林小英"
http://www.gxjjw.gov.cn/staticpages/20160930/gxjjw57ee2a69-118959.shtml,北海市农业局原调研员卢永佳被双开,2016-09-30 17:03,北海市纪委,"据北海市纪委消息：日前，经中共北海市委批准，中共北海市纪委对北海市农业局调研员卢永佳严重违纪问题立案审查。,经查，卢永佳违反廉洁纪律，违规收受礼金；利用职务上的便利，在借款担保、承租土地、承揽工程项目、人事任免、项目合作、农业补贴等方面，为他人谋取利益并收受他人财物，侵吞公共财物，情节严重；对市农业局索取农民专业合作社财物负主要责任。涉嫌构成犯罪。,卢永佳身为党员领导干部，理想信念丧失，纪律意识淡薄，严重违反党的纪律，且在党的十八大后仍不收敛、不收手，依据《中国共产党纪律处分条例》等有关规定，经市纪委常委会议研究、市委常委会议审议，呈报自治区纪委常委会议讨论并报自治区党委常委会议决定，给予卢永佳开除党籍处分；由北海市监察局报北海市政府批准，给予其开除公职处分；收缴其违纪所得；将其涉嫌犯罪问题及线索移送司法机关依法处理。,编辑：林小英"
http://www.gxjjw.gov.cn/staticpages/20161010/gxjjw57fb4c3b-119041.shtml,桂林市永福县委常委、宣传部长、副县长孙玉杰被开除党籍和公职,2016-10-10 16:07,桂林市纪委,"据桂林市纪委消息：日前，中共桂林市纪律检查委员会对桂林市永福县委常委、宣传部长、副县长孙玉杰进行了立案审查。,经查，孙玉杰违反廉洁纪律，收受礼金，违规从事营利性活动，为亲属的营利活动谋利；利用职务之便为他人谋取利益并收受财物，涉嫌受贿犯罪。,孙玉杰身为党员领导干部，严重违反党的纪律，性质恶劣，情节严重。依据《中国共产党纪律处分条例》等相关规定，经中共桂林市纪律检查委员会审议并报中共桂林市委员会批准，决定给予孙玉杰开除党籍、开除公职处分；将其涉嫌犯罪问题、线索移送司法机关依法处理。,编辑：刘梦云"
http://www.gxjjw.gov.cn/staticpages/20160803/gxjjw57a1ac14-117509.shtml,玉林市委常委、统战部部长麦承标接受组织调查,2016-08-03 16:32,自治区纪委,"广西壮族自治区玉林市委常委、统战部部长麦承标因涉嫌严重违纪，目前正接受组织调查。,麦承标简历,麦承标，男，汉族，广西玉林人，1967年9月出生，中共党员，在职研究生学历，1987年12月加入中国共产党，1989年7月参加工作。2006年7月至2008年12月，任桂平市委副书记、市长；2008年12月至2011年3月，任桂平市委书记；2011年3月至2016年3月，任北海市委常委、合浦县委书记；2016年3月至今，任玉林市委常委、统战部部长。,编辑：林小英"
http://www.gxjjw.gov.cn/staticpages/20160805/gxjjw57a45c6b-117556.shtml,合浦县水产畜牧兽医局党组书记、局长吴东接受组织调查,2016-08-05 17:29,北海市纪委,"据北海市纪委消息：北海市合浦县水产畜牧兽医局党组书记、局长吴东涉嫌严重违纪，目前正接受组织调查。,吴东简历：,吴东，男，1975年10月生，汉族，合浦县白沙镇人，在职大学学历，1999年3月加入中国共产党，1993年2月参加工作。2005年9月至2008年7月任合浦县沙田镇党委副书记、镇长；2008年7月至2010年12月任合浦县沙田镇党委书记；2010年12月至2012年7月任合浦县常乐镇党委书记；2012年7月至2013年5月任合浦县文联主席；2013年5月至今任合浦县水产畜牧兽医局党组书记、局长。,编辑：林小英"
http://www.gxjjw.gov.cn/staticpages/20160805/gxjjw57a45d4f-117554.shtml,柳江县政协党组副书记、主席周少安严重违纪被给予撤销党内职务处分,2016-08-05 17:33,柳州市纪委,"据柳州市纪委消息：日前，经柳州市委批准，柳州市纪委对柳江县政协党组副书记、主席周少安违纪问题进行立案审查。,经查，周少安在担任柳江县政协党组书记、主席期间，违反廉洁纪律，接受他人给予的礼品、礼金，数额较大。,周少安身为党员领导干部，违反党的纪律，且在党的十八大后仍不收敛、不收手，情节较重。依据《中国共产党纪律处分条例》的有关规定，经柳州市纪委审议并报柳州市委批准，决定给予周少安撤销其柳江县政协党组副书记职务，由正处长级降为副处级；建议柳江县政协按程序免去其政协主席职务。,编辑：林小英"
http://www.gxjjw.gov.cn/staticpages/20160805/gxjjw57a4631a-117564.shtml,自治区公安厅原副巡视员韦宁贤严重违纪被开除党籍并取消退休待遇,2016-08-05 17:57,自治区纪委,"日前，中共广西壮族自治区纪律检查委员会对自治区公安厅原副巡视员韦宁贤严重违纪问题进行了立案审查。,经查，韦宁贤违反政治纪律，与他人订立攻守同盟，转移、隐匿证据，对抗组织审查。违反组织纪律，不如实报告个人有关事项。违反廉洁纪律，利用职务上的便利为他人谋取利益并收受巨额财物，违规收受礼金、经商办企业。违反工作纪律，违规同意预付工程款及出借公款。违反生活纪律，与多名女性长期保持不正当性关系，造成严重不良影响。违反国家法律法规，诬告陷害他人。其中，利用职务上的便利为他人谋取利益并收受巨额财物、诬告陷害他人问题涉嫌犯罪。,韦宁贤身为党员领导干部，理想信念丧失，严重违反党的纪律，且在党的十八大后仍不收敛、不收手，情节严重，影响恶劣。根据《中国共产党纪律处分条例》等有关规定，经中共广西壮族自治区纪律检查委员会审议、并报中共广西壮族自治区委员会批准，决定给予韦宁贤开除党籍处分、取消其退休待遇；收缴其违纪所得，将其涉嫌犯罪问题及线索移送司法机关依法处理。取消韦宁贤退休待遇由广西壮族自治区监察厅按程序报广西壮族自治区人民政府批准。,编辑：林小英"
http://www.gxjjw.gov.cn/staticpages/20160805/gxjjw57a46333-117565.shtml,中共桂平市委原书记杨评防严重违纪被开除党籍和公职,2016-08-05 17:58,自治区纪委,"日前，中共广西壮族自治区纪律检查委员会对中共桂平市委原书记杨评防（副厅级）严重违纪问题进行立案审查。,经查，杨评防违反生活纪律，与他人发生不正当性关系，造成不良影响；利用职务上的便利为他人谋取利益并收受财物，涉嫌受贿犯罪。,杨评防身为党员领导干部，理想信念丧失，严重违反党的纪律，且党的十八大以后特别是自治区党委约谈县委书记后，仍不收敛、不收手，性质恶劣、情节严重。根据《中国共产党纪律处分条例》等有关规定，经中共广西壮族自治区纪律检查委员会审议并报中共广西壮族自治区委员会批准，决定给予杨评防开除党籍、开除公职处分，将其涉嫌犯罪问题及线索移送司法机关依法处理。,编辑：林小英"
http://www.gxjjw.gov.cn/staticpages/20160805/gxjjw57a46348-117566.shtml,中共贵港市委原常委、贵港市政府原常务副市长黄志光严重违纪被开除党籍、开除公职,2016-08-05 17:58,自治区纪委,"日前，中共广西壮族自治区纪律检查委员会对中共贵港市委原常委、贵港市政府原常务副市长黄志光涉嫌严重违纪问题进行立案审查。,经查，黄志光身为党员领导干部，违反组织纪律，不如实报告个人有关事项；违反廉洁纪律，与他人合伙经商办企业；违反生活纪律，长期与他人保持不正当性关系，造成不良影响；利用职务上的便利，为他人谋取利益并收受他人巨额财物，且在党的十八大后仍不收敛、不收手，情节严重，涉嫌犯罪。根据《中国共产党纪律处分条例》的有关规定，经中共广西壮族自治区纪律检查委员会审议并报中共广西壮族自治区委员会批准，决定给予黄志光开除党籍处分、开除公职处分，收缴其违纪所得，将其涉嫌犯罪问题及线索移送司法机关依法处理。给予黄志光开除公职处分由广西壮族自治区监察厅按程序报广西壮族自治区人民政府批准。,编辑：林小英"
http://www.gxjjw.gov.cn/staticpages/20160810/gxjjw57aa6eb8-118016.shtml,北海市银海区福成镇党委委员孙敬昭接受组织调查,2016-08-10 08:00,北海市纪委,"据北海市纪委消息：北海市银海区福成镇党委委员孙敬昭涉嫌严重违纪，目前正接受组织调查。,编辑：刘梦云"
http://www.gxjjw.gov.cn/staticpages/20160810/gxjjw57aa73ec-117621.shtml,柳州市柳东新区、柳州高新技术产业开发区管委会原副主任、党工委原副书记范宁严重违纪被开除党籍和公职,2016-08-10 08:23,柳州市纪委,"据柳州市纪委消息：日前，经柳州市委批准，柳州市纪委对柳州市柳东新区、柳州高新技术产业开发区管委会副主任、党工委副书记范宁严重违纪问题进行立案审查。,经查，范宁在担任柳江县副县长期间，严重违反廉洁纪律，利用其职务上的便利，为他人谋取利益并收受财物，数额巨大，已涉嫌犯罪。,范宁身为党员领导干部，理想信念丧失，严重违反党的纪律，情节严重。依据《中国共产党纪律处分条例》等有关规定，经柳州市纪委审议并报柳州市委批准，决定给予范宁开除党籍处分；由柳州市监察局报柳州市政府批准，给予其开除公职处分。,编辑：刘梦云"
