url,title,date,source,text
http://www.nmgjjjc.gov.cn/ajcc/7945444.shtml,内蒙古自治区乌海市委原书记侯凤岐严重违纪被开除党籍和公职,2017-02-18 22:04,自治区纪委案件审理室,"日前，经内蒙古自治区党委批准，内蒙古自治区纪委对乌海市委原书记侯凤岐严重违纪问题进行了立案审查。,经查，侯凤岐严重违反政治纪律，对抗组织审查、参加迷信活动；违反中央ldquo八项规定rdquo精神，违规发放补贴；违反组织纪律，不按规定如实报告个人有关事项；违反廉洁纪律，收受礼品、礼金；违反生活纪律，与他人发生不正当性关系；违反国家法律法规规定，违规向企业摊派赞助费，利用职务上的便利为他人谋取利益并收受财物，涉嫌受贿犯罪。,侯凤岐身为党的领导干部，严重违反党的纪律，且在党的十八大后仍不收敛、不收手，其违纪行为性质恶劣、情节严重，应予严肃处理。依据《中国共产党纪律处分条例》等有关规定，经内蒙古自治区纪委常委会议审议并报自治区党委批准，决定给予侯凤岐开除党籍、开除公职处分；收缴其违纪所得；将其涉嫌犯罪问题、线索及所涉款物移送司法机关依法处理。"
http://www.nmgjjjc.gov.cn/ajcc/7945456.shtml,内蒙古自治区乌兰察布市政府原副市长薛培明严重违纪被开除党籍,2017-02-18 22:05,自治区纪委案件审理室,"日前，经内蒙古自治区党委批准，内蒙古自治区纪委对乌兰察布市政府原副市长薛培明严重违纪问题进行了立案审查。,经查，薛培明严重违反组织纪律，违规为已退休的妻子安排事业编制工作，并再次办理退休手续，利用职务上的便利在干部选拔任用中为他人谋取利益并收受财物；违反廉洁纪律，收受礼品，违规从事营利活动并从中获利，退休后违规在企业任职；违反国家法律法规规定，滥用职权，违规转让探矿权，利用职务上的便利和影响，在项目审批等方面为他人谋取利益并收受财物。利用职务上的便利为他人谋取利益并收受财物问题涉嫌犯罪。,薛培明身为党的领导干部，理想信念丧失，严重违反党的纪律，性质恶劣，情节严重，应予严肃处理。依据《中国共产党纪律处分条例》等有关规定，经内蒙古自治区纪委常委会议审议并报自治区党委批准，决定给予薛培明开除党籍处分，取消其享受的退休待遇；收缴其违纪所得；将其涉嫌犯罪问题、线索及所涉款物移送司法机关依法处理。"
http://www.nmgjjjc.gov.cn/ajcc/7945468.shtml,内蒙古自治区赤峰市政法委原书记孟繁有严重违纪被开除党籍,2017-02-18 22:06,自治区纪委案件审理室,"日前，经内蒙古自治区党委批准，内蒙古自治区纪委对赤峰市政法委原书记孟繁有严重违纪问题进行了立案审查。,经查，孟繁有违反组织纪律，利用职务上的便利，在干部选拔任用、安排工作方面为他人谋取利益并收受财物；违反国家法律法规规定，利用职务上的便利，为他人在工程建设、具体案件处置等方面谋取利益并收受财物，伙同他人共同贪污公款。利用职务上的便利为他人谋取利益并收受财物和伙同他人贪污公款问题涉嫌犯罪。,孟繁有身为党的领导干部，理想信念丧失，严重违反党的纪律，性质恶劣，情节严重，应予严肃处理。依据《中国共产党纪律处分条例》等有关规定，经内蒙古自治区纪委常委会议审议并报自治区党委批准，决定给予孟繁有开除党籍处分，取消其享受的退休待遇；将其涉嫌犯罪问题及所涉款物移送司法机关依法处理。"
http://www.nmgjjjc.gov.cn/ajcc/7945546.shtml,内蒙古自治区通辽市政府原副市长许亚林 严重违纪被开除党籍,2017-02-18 22:13,自治区纪委案件审理室,"日前，经内蒙古自治区党委批准，内蒙古自治区纪委对通辽市政府原副市长许亚林严重违纪问题进行了立案审查。,经查，许亚林违反国家法律法规规定，利用职务上的便利，为他人在企业经营、承揽工程及结算工程款等方面谋取利益并收受财物，贪污公款和套取拆迁补偿款；违规侵占集体土地；妨害社会管理秩序，利用职务影响和职务上的便利违规为本人办理虚假信息身份证。利用职务上的便利为他人谋取利益并收受财物、贪污公款和套取拆迁补偿款问题涉嫌犯罪。,许亚林身为党员领导干部，理想信念丧失，严重违反党的纪律，性质恶劣，情节严重，应予严肃处理。依据《中国共产党纪律处分条例》和《行政机关公务员处分条例》等有关规定，经内蒙古自治区纪委常委会议审议并报自治区党委批准，决定给予许亚林开除党籍处分；由自治区监察厅报请自治区政府批准，给予其开除公职处分；收缴其违纪所得；将其涉嫌犯罪问题及所涉款物移送司法机关依法处理。"
http://www.nmgjjjc.gov.cn/ajcc/8552250.shtml,内蒙古自治区巴彦淖尔市副市长贺福宝接受组织审查,2017-03-28 16:08,自治区纪委案件监督管理室,内蒙古自治区巴彦淖尔市副市长贺福宝涉嫌严重违纪，目前正在接受组织审查。
http://www.nmgjjjc.gov.cn/ajcc/3134342.shtml,内蒙古自治区供销合作社理事会副主任张鳞龙接受组织调查,2016-04-22 19:31,自治区纪委案件监督管理室,内蒙古自治区供销合作社理事会副主任张鳞龙涉嫌严重违纪，目前正在接受组织调查。
http://www.nmgjjjc.gov.cn/ajcc/3227654.shtml,内蒙古自治区乌兰察布市市委副书记、市长陶淑菊接受组织调查,2016-04-28 18:49,自治区纪委案件监督管理室,内蒙古自治区乌兰察布市市委副书记、市长陶淑菊涉嫌严重违纪，目前正在接受组织调查。
http://www.nmgjjjc.gov.cn/ajcc/3502706.shtml,内蒙古银行原党委书记、董事长姚永平严重违纪，被开除党籍、开除公职,2016-05-16 19:31,内蒙古纪检监察网,内蒙古银行原党委书记、董事长姚永平严重违纪，被开除党籍、开除公职。
http://www.nmgjjjc.gov.cn/ajcc/3502740.shtml,内蒙古银行原党委书记、董事长杨成林严重违纪，被开除党籍、开除公职,2016-05-16 19:33,内蒙古纪检监察网,内蒙古银行原党委书记、董事长杨成林严重违纪，被开除党籍、开除公职。
http://www.nmgjjjc.gov.cn/ajcc/5842998.shtml,内蒙古自治区国土资源厅原党组书记、厅长，鄂尔多斯市市委原常委、副市长李世镕接受组织调查,2016-10-11 16:18,自治区纪委案件监督管理室,内蒙古自治区国土资源厅原党组书记、厅长，鄂尔多斯市市委原常委、副市长李世镕涉嫌严重违纪，目前正在接受组织调查。
http://www.nmgjjjc.gov.cn/ajcc/7007876.shtml,赤峰市委原副书记包崇明严重违纪违法，被开除党籍、开除公职,2016-12-22 18:47,内蒙古纪委案件审理室,"据内蒙古自治区纪委消息：日前，经内蒙古自治区党委批准，自治区纪委对赤峰市委原副书记包崇明严重违纪问题进行了立案审查。,经查，包崇明严重违反组织纪律，利用职务上的便利为他人提拔任用谋取利益，收受他人财物；严重违反廉洁纪律，违规入股企业、违规获取银行贷款进行放贷从中谋取利益；严重违反国家法律法规规定，利用职务上的便利在煤炭资源配置、工程建设等方面为他人谋取利益，收受他人财物，滥用职权违规处置国有煤炭资源，造成重大损失。,包崇明身为党的领导干部，理想信念丧失，严重违反党的纪律和国家法律法规规定，性质恶劣、情节严重。依据《中国共产党纪律处分条例》等有关规定，经内蒙古自治区党委批准，决定给予包崇明开除党籍、开除公职处分；收缴其违纪所得；将其涉嫌犯罪问题、线索及所涉款物移送司法机关依法处理。"
http://www.nmgjjjc.gov.cn/ajcc/2187668.shtml,阿拉善盟公共资源交易中心原副主任张浩被留党察看、行政撤职,2016-02-22 15:52,阿拉善盟纪委监察局,"日前，经中共阿拉善盟委批准，阿拉善盟纪委对阿拉善盟公共资源交易中心原副主任张浩违纪问题进行了立案审查。,经查，张浩在担任盟公共资源交易中心副主任期间，不履行或不正确履行职责，滥用职权违反规定处置公车；在项目采购过程中存在违规操作、档案管理混乱、资料丢失等问题。,依据《中国共产党纪律处分条例》等有关规定，经盟纪委委员会议审议并报盟委批准，决定给予张浩留党察看二年处分；由盟监察局报盟行署批准，给予其行政撤职处分，由副处级领导职务降为正科级非领导职务。"
http://www.nmgjjjc.gov.cn/ajcc/2252565.shtml,内蒙古雅布赖盐化集团有限公司原党委委员、董事、总经理赵明庆严重违纪被开除党籍、行政开除,2016-02-26 17:40,内蒙古纪检监察网,"日前，经阿拉善盟盟委批准，阿拉善盟纪委对内蒙古雅布赖盐化集团有限公司原党委委员、董事、总经理赵明庆严重违纪问题进行了立案审查。,经查，赵明庆利用职务上的便利，为他人谋取利益，收受他人财物；挪用公款进行营利活动；违反规定，为公司班子成员配股、报销购车费；设立和使用账外资金、发放交通费补贴。,依据《中国共产党纪律处分条例》等有关规定，经盟纪委委员会议审议并报盟委批准，决定给予赵明庆开除党籍处分；由盟监察局报盟行署批准，给予其行政开除处分；收缴其违纪所得，将其涉嫌犯罪问题线索移送司法机关依法处理。"
http://www.nmgjjjc.gov.cn/ajcc/2466436.shtml,内蒙古雅布赖盐化集团有限公司5人因违纪受到党纪、政纪处分,2016-03-12 08:00,阿拉善盟纪委监察局,"日前，经盟纪委委员会议审议并报请盟委批准，决定对内蒙古雅布赖盐化集团有限公司原党委副书记、纪委书记巴亘等5人违纪问题进行立案审查。,经查，内蒙古雅布赖盐化集团有限公司原党委副书记、纪委书记巴亘，副总经理李玉明、王香德、张发荣（退休）、姜培德（退休）五人在任职期间存在以配股名义、购车名义私分国有资产、违规领取交通费和违反财经纪律等违纪问题，其行为违反了《中国共产党党员领导干部廉洁从政若干准则》、《国有企业领导人员廉洁从业若干规定》，构成私分国有资产、违反财经纪律和失职等错误。依照《中国共产党纪律处分条例》和《行政机关公务员处分条例》等有关规定，2016年2月25日，经盟纪委第10次委员会议和盟监察局第10次局长办公会议研究决定，给予巴亘、李玉明、王香德、张发荣（退休）、姜培德（退休）五人党内严重警告处分，给予巴亘、李玉明、王香德三人行政记大过处分，并将违纪所得予以收缴。,盟委决定，提名免去李玉明、王香德同志内蒙古雅布赖盐化集团有限公司副总经理职务，巴亘同志不再担任内蒙古雅布赖盐化集团有限公司党委副书记、党委委员、纪委书记、工会主席，提名免去内蒙古雅布赖盐集团有限公司监事会主席职务。"
http://www.nmgjjjc.gov.cn/ajcc/2562095.shtml,兴安盟乌兰浩特市委副调研员王才接受组织调查,2016-03-17 11:28,兴安盟纪委监察局,兴安盟乌兰浩特市委副调研员王才涉嫌严重违纪，目前正在接受组织调查。
http://www.nmgjjjc.gov.cn/ajcc/2583250.shtml,内蒙古自治区兴安盟行署原副盟长步进来接受组织调查,2016-03-18 18:46,内蒙古纪检监察网,兴安盟行署原副盟长步进来涉嫌严重违纪，目前正在接受组织调查。
http://www.nmgjjjc.gov.cn/ajcc/2966186.shtml,阿拉善右旗：公安局两民警因严重违纪被“双开”,2016-04-12 08:00,阿拉善右旗纪委监察局,"日前，阿拉善右旗纪委对旗公安局贡湖都格派出所所长李树雄、交警大队民警王伟2人严重违纪问题进行立案审查。,经查，李树雄、王伟存在违规经商，从事营利性活动；为谋取不正当利益，向国企负责人近亲属以支付提成款方式行贿；李树雄伙同国企负责人虚列支出侵吞公款等违纪问题。,依据《中国共产党纪律处分条例》、《行政机关公务员处分条例》等有关规定，经旗纪委常委会议审议并报旗委批准，决定给予李树雄、王伟开除党籍处分；由旗监察局报旗人民政府批准，给予李树雄、王伟开除公职处分，将2人涉嫌犯罪问题线索移送司法机关依法处理。"
http://www.nmgjjjc.gov.cn/ajcc/729530.shtml,鄂尔多斯市政府原副市长、市公安局原党委书记、局长王会师被开除党籍、开除公职,2015-09-02 09:40,自治区纪委案件审理室,鄂尔多斯市政府原副市长、市公安局原党委书记、局长王会师严重违纪违法，被开除党籍、开除公职，其涉嫌犯罪问题及线索已移送司法机关依法处理。
http://www.nmgjjjc.gov.cn/ajcc/731223.shtml,内蒙古金融投资集团有限公司原党委书记、董事长王振坤被开除党籍、开除公职,2015-09-09 11:35,自治区纪委案件审理室,内蒙古金融投资集团有限公司原党委书记、董事长王振坤严重违纪违法，被开除党籍、开除公职，其涉嫌犯罪问题及线索已移送司法机关依法处理。
http://www.nmgjjjc.gov.cn/ajcc/864695.shtml,内蒙古自治区通辽市人民政府副市长许亚林接受组织调查,2015-11-03 18:50,自治区纪委案件监督管理室,内蒙古自治区通辽市人民政府副市长许亚林涉嫌严重违纪，目前正在接受组织调查。
http://www.nmgjjjc.gov.cn/ajcc/1037972.shtml,内蒙古自治区乌海市市委书记侯凤岐接受组织调查,2015-11-20 13:38,自治区纪委案件监督管理室,经内蒙古自治区党委批准，内蒙古自治区乌海市市委书记侯凤岐涉嫌严重违纪，目前正在接受组织调查。
http://www.nmgjjjc.gov.cn/ajcc/1111010.shtml,呼和浩特市纪委调研员（原副书记）白冰接受组织调查,2015-11-27 16:06,内蒙古纪检监察网,内蒙古自治区呼和浩特市纪委调研员（原副书记）白冰涉嫌严重违纪，目前正在接受组织调查。
http://www.nmgjjjc.gov.cn/ajcc/1542059.shtml,呼和浩特市原市长汤爱军被开除党籍,2016-01-08 17:51,自治区纪委案件审理室,经自治区党委同意，自治区纪委对呼和浩特市原市长汤爱军严重违纪问题进行了立案审查。经查，汤爱军违反廉洁自律规定，收受礼品礼金；利用职务便利和影响，收受他人财物，为他人谋取利益，已构成严重违纪，并涉嫌违法犯罪。经自治区纪委常委会议研究，并报自治区党委常委会议批准，决定给予汤爱军开除党籍处分、取消退休待遇，收缴其违纪所得，将其涉嫌犯罪问题、线索及涉嫌违法所得款物移送司法机关依法处理。
http://www.nmgjjjc.gov.cn/ajcc/599328.shtml,内蒙古自治区赤峰市市委副书记包崇明接受组织调查,2015-01-22 19:34,自治区纪委案件监督管理室,内蒙古自治区赤峰市市委副书记包崇明涉嫌严重违纪违法，目前正在接受组织调查。
http://www.nmgjjjc.gov.cn/ajcc/703003.shtml,通辽市市委原常委、政府原副市长张国秋接受组织调查,2015-05-15 17:40,自治区纪委案件监督管理室,内蒙古自治区通辽市市委原常委、政府原副市长张国秋（现享受正厅级非领导职务待遇）涉嫌严重违纪违法，目前正在接受组织调查。
http://www.nmgjjjc.gov.cn/ajcc/703004.shtml,鄂尔多斯市市委常委、东胜区委书记张平接受组织调查,2015-05-15 17:40,自治区纪委案件监督管理室,内蒙古自治区鄂尔多斯市市委常委、东胜区委书记张平涉嫌严重违纪违法，目前正在接受组织调查。
http://www.nmgjjjc.gov.cn/ajcc/716830.shtml,呼伦贝尔市交通运输局原党组成员、总工程师俞志森（副处级）被“双开”,2015-07-03 16:51,呼伦贝尔市纪委监察局,呼伦贝尔市交通运输局原党组成员、总工程师俞志森（副处级），其违反廉洁自律规定，收受礼金107万元；违反廉洁自律规定，从事营利活动，获益257万元，构成严重违纪违法。经呼伦贝尔市纪委常委会研究决定，给予俞志森开除党籍处分，收缴其违纪所得。经呼伦贝尔市监察局局长办公会研究决定，给予俞志森开除公职处分。其涉嫌犯罪问题及线索已移送司法机关依法处理。
http://www.nmgjjjc.gov.cn/ajcc/725022.shtml,内蒙古自治区乌兰察布市原副市长薛培明接受组织调查,2015-08-12 12:44,自治区纪委案件监督管理室,内蒙古自治区乌兰察布市原副市长薛培明涉嫌严重违纪，目前正在接受组织调查。
http://www.nmgjjjc.gov.cn/ajcc/725029.shtml,内蒙古自治区乌兰察布市政协副主席肖万寿接受组织调查,2015-08-12 12:46,自治区纪委案件监督管理室,内蒙古自治区乌兰察布市政协副主席肖万寿涉嫌严重违纪，目前正在接受组织调查。
http://www.nmgjjjc.gov.cn/ajcc/582060.shtml,自治区交通运输厅副巡视员袁志刚接受组织调查,2014-11-27 12:57,自治区纪委案件监督管理室,自治区交通运输厅副巡视员袁志刚涉嫌严重违纪违法，目前正在接受组织调查。
http://www.nmgjjjc.gov.cn/ajcc/583242.shtml,锡盟纪委通报4起副处级干部违纪案件,2014-12-01 10:31,锡盟纪委监察局,"1、锡盟正蓝旗政府副旗长，公安局党委书记、公安局长布古城利用职务之便，委托他人隐瞒事实真相、为妻子肖某办理虚假人事档案并安排调动工作，其行为已构成严重违纪。,锡盟盟委决定，给予布古城撤销正蓝旗政府党组成员、公安局党委书记职务、降级处分；按照程序免去其正蓝旗副旗长、公安局局长职务；锡盟纪委收缴其妻子肖某冒领的工资以及享受的住房、医疗保险等待遇共计148056.18元。,2、锡盟多伦县政府副县长杨文普在任多伦县国土局局长期间，参与为布古城妻子肖某办理虚假人事档案及安置调动手续，其行为已构成违纪。,锡盟盟委决定，给予杨文普党内警告处分。,3、锡盟镶黄旗公安局政委孟庆国（副处级）利用职务之便，受贿8万元人民币，其行为已构成违纪违法。,锡盟盟委决定，给予孟庆国开除党籍、开除公职处分；其涉嫌违法问题及线索移交司法机关依法处理。,4、锡盟苏尼特左旗政协副主席娜仁通嘎拉嘎（女）利用职务之便，违规占用巴彦宝力道嘎查集体草场6971亩，并转入违规转为农业户籍的女儿名下，其行为已构成违纪。,锡盟盟委决定，给予娜仁通嘎拉嘎党内严重警告处分；责成有关部门收回其违规占用的草场；锡盟纪委收缴其女儿冒领的草畜平衡奖励资金35761元。"
http://www.nmgjjjc.gov.cn/ajcc/584639.shtml,包头市政府原副市长张继平严重违纪违法，被开除党籍、开除公职,2014-12-03 18:15,自治区纪委案件监督管理室,"包头市政府原副市长张继平,提交审核,严重违纪违法，被开除党籍、开除公职，将其涉嫌犯罪问题移送司法机关依法处理。"
http://www.nmgjjjc.gov.cn/ajcc/586084.shtml,自治区纪委案件审理室原主任沈佳严重违纪违法，被开除党籍、开除公职,2014-12-08 11:04,自治区纪委宣传部,自治区纪委案件审理室原主任沈佳严重违纪违法，被开除党籍、开除公职，其涉嫌犯罪问题移送司法机关依法处理。
http://www.nmgjjjc.gov.cn/ajcc/589150.shtml,内蒙古雅布赖盐化集团有限公司原党委书记、董事长杨志福严重违纪违法被“双开”,2014-12-16 16:20,阿拉善盟纪委监察局,内蒙古雅布赖盐化集团有限公司原党委书记、董事长杨志福严重违纪违法，经阿拉善盟纪委委员会议、监察局长办公会议研究并报请阿拉善盟盟委、行署批准，决定给予杨志福开除党籍和开除公职处分，对其涉嫌犯罪问题及线索移送司法机关依法处理。
http://www.nmgjjjc.gov.cn/ajcc/591895.shtml,锡林郭勒盟纪委通报4起违纪案件,2014-12-24 10:02,锡林郭勒盟纪委监察局,"1、锡盟中级人民法院执行局原副局长刘长有（正科级），挪用巨额执行款进行理财、放贷、无偿借给他人使用；接受他人礼金；私藏弹药和危爆物品；其行为已构成严重违纪违法。经锡盟纪委委员会议研究，决定给予刘长有开除党籍处分；收缴其违纪所得，接收其登记上交其它所得并上缴国库。锡盟中级人民法院已给予其开除公职处分。其涉嫌犯罪问题及线索已移送司法机关依法处理。,2、东乌珠穆沁旗环保局原局长代钦，收受他人贿赂，接受他人礼金，其行为已构成违纪违法。经锡盟纪委委员会议研究，决定给予代钦开除党籍处分，收缴其违纪所得上缴国库；经锡盟监察局局长办公会议研究，决定给予其开除公职处分。其涉嫌犯罪问题及线索已移送司法机关依法处理。,3、东乌珠穆沁旗地税局原副局长郝占雄（正科级），收受他人贿赂和接受礼金，其行为已构成严重违纪违法。经锡盟纪委委员会议研究，决定给予郝占雄开除党籍处分；建议锡盟地税局给予其开除公职处分；收缴其违纪所得，接收其登记上交其它所得并上缴国库。其涉嫌犯罪问题及线索已移送司法机关依法处理。,4、镶黄旗公安局法制科原科长王治国，收受他人贿赂，其行为已构成违纪违法。经锡盟纪委委员会议研究，决定给予王治国开除党籍处分；经锡盟监察局局长办公会议研究，决定给予其开除公职处分。其涉嫌犯罪问题及线索已移送司法机关依法处理。"
http://www.nmgjjjc.gov.cn/ajcc/517146.shtml,科右中旗纪委监察局对旗水利局包锁立案调查,2014-07-16 14:31,科右中旗纪检监察网,近日，科右中旗纪委监察局，对旗水利局原副局长包锁因工作中玩忽职守等问题被依法判决免于刑罚的问题，依据《中国共产党纪律处分条例》相关规定，立案追究其党政纪责任。
http://www.nmgjjjc.gov.cn/ajcc/517580.shtml,自治区纪委对白海泉立案调查,2014-07-17 12:11,内蒙古纪检监察网,呼和浩特市经济技术开发区金川工业园区党委书记、管委会主任白海泉涉嫌严重违纪违法。目前，自治区纪委正在对其立案调查。
http://www.nmgjjjc.gov.cn/ajcc/523156.shtml,内蒙古自治区纪委监察厅案件审理室原主任沈佳被移送司法机关,2014-08-06 09:33,内蒙古纪检监察网,日前，内蒙古自治区纪委监察厅对案件审理室原主任沈佳（副厅级）涉嫌严重违法违纪问题进行立案调查。近日，内蒙古自治区纪委监察厅已将其涉嫌犯罪问题移送司法机关依法处理。
http://www.nmgjjjc.gov.cn/ajcc/537436.shtml,克什克腾旗通报五起基层党员干部违纪案件,2014-08-13 10:53,克什克腾旗纪委监察局,"今年以来，克什克腾旗纪委集中查办涉及农村ldquo三资rdquo管理使用、违反财经纪律、违法用地及其他损害群众利益的五起农村基层党员干部违纪违法案件。截至7月，共有8名嘎查村党员干部受到党纪处分。,1、乌兰布统苏木小红山子嘎查党支部书记兼嘎查达林某，非法与承包方变更乌兰公河小塘坝承包协议书承包期限、非法转让100亩土地使用权，给予林某开除党籍处分。,2、达来诺日镇托力嘎查党支部书记哈某、嘎查达额某，利用职务之便用自家的打草场与集体机动草牧场互换，获取个人利益、挪用饲草料调运所需救灾补贴资金的问题，哈某受到留党察看二年处分；额某受到留党察看一年处分。,3、土城子镇乌兰哈吉盖村党支部书记姜某、村委会主任郭某、村委会副主任刘某，采取虚报手段套取财政补贴种草款、在实施国家畜牧业良种补贴项目中违规操作，截留农牧养殖户良种补贴款，姜某受到撤销党内职务处分、郭某受到留党察看一年处分、刘某受到党内严重警告处分。,4、经棚镇呼必图村村党支部书记吴某，违反交通运输管理法规，在道路上醉酒驾驶机动车，危害公共安全，受到党内严重警告处分。,5、乌兰布统苏木黄芩塔拉嘎查党支部书记耿某，违反交通运输管理法规，无证驾驶无牌照小型普通客车，造成交通事故，耿某受到撤销党内职务处分。"
http://www.nmgjjjc.gov.cn/ajcc/538166.shtml,呼和浩特市原市长汤爱军接受组织调查,2014-08-15 22:51,自治区纪委宣传部,呼和浩特市原市长汤爱军涉嫌严重违纪违法问题，目前正在接受组织调查。
http://www.nmgjjjc.gov.cn/ajcc/540350.shtml,赤峰市阿鲁科尔沁旗旗委书记周春义接受组织调查,2014-08-21 13:20,自治区纪委案件监督管理室,赤峰市阿鲁科尔沁旗旗委书记周春义涉嫌严重违纪违法，目前正在接受组织调查。
