url,title,date,source,text
http://www.nxjjjc.gov.cn/jlsc/qn/201511/t20151106_3500617.html,宁夏回族自治区政府副主席白雪山涉嫌严重违纪接受组织调查,2015-11-06,中央纪委监察部网站,"宁夏回族自治区政府副主席白雪山涉嫌严重违纪，目前正接受组织调查。,白雪山简历：,白雪山，男，汉族，1961年5月出生，陕西吴起人，1984年2月参加工作，1984年5月加入中国共产党，中央党校函授学院经济管理专业毕业，中央党校大学学历。先后担任银川市郊区党委副书记、区长，吴忠市委书记、市人大常委会主任。,现任自治区政府副主席。,1984年2月至1993年5月，先后在银川市郊区第二建筑工程公司、银川市政府驻上海联络处等单位工作；,1993年5月任银川市政府驻上海联络处主任；,1994年9月任银川市郊区党委常委、副区长；,1995年2月任银川市郊区党委副书记、代区长、区长；,1996年12月任银川市郊区党委书记；,2001年2月任银川市委常委、郊区党委书记；,2001年9月任银川市委常委、贺兰县委书记；,2002年11月任银川市委常委、副市长；,2003年12月任银川市委副书记、副市长；,2005年7月任银川市委副书记、代市长；,2006年1月任银川市委副书记、市长；,2007年9月任吴忠市委书记、市人大常委会党组书记；,2007年12月任吴忠市委书记，市人大常委会主任、党组书记；,2013年1月任自治区政府副主席、党组成员。（简历摘自宁夏回族自治区政府官网）"
http://www.nxjjjc.gov.cn/yw/201511/t20151113_3503337.html,青铜峡市委副书记、市长张国彦接受组织调查,2015-11-13,宁夏纪委监察厅网站,青铜峡市委副书记、市长张国彦涉嫌严重违纪，目前正接受组织调查。
http://www.nxjjjc.gov.cn/jlsc/qn/201512/t20151228_3523232.html,宁夏回族自治区政府原党组成员、副主席白雪山严重违纪被开除党籍和公职,2015-12-28,中央纪委监察部网站,"日前，经中共中央批准，中共中央纪委对宁夏回族自治区政府原党组成员、副主席白雪山严重违纪问题进行了立案审查。,经查，白雪山严重违反政治纪律，党员意识淡漠，对抗组织审查，长期搞迷信活动；严重违反组织纪律，在组织函询时不如实向组织说明问题，利用职务上的便利在干部选拔任用中为他人谋取利益并收受财物；严重违反廉洁纪律，在企业经营等方面为他人谋取利益并收受财物，为亲友经营活动谋取利益。其中，利用职务上的便利为他人谋取利益，收受财物问题涉嫌犯罪。,白雪山身为党的高级领导干部，理想信念丧失，严重违反党的纪律，且党的十八大后仍不收敛、不收手，性质恶劣、情节严重。依据《中国共产党纪律处分条例》等有关规定，经中央纪委常委会议审议并报中共中央批准，决定给予白雪山开除党籍处分；由监察部报国务院批准，给予其行政开除处分；将其涉嫌犯罪问题、线索及所涉款物移送司法机关依法处理。"
http://www.nxjjjc.gov.cn/jlsc/qn/201512/t20151229_3523563.html,宁夏精细化工基地党工委原书记龚明科严重违纪被开除党籍和公职,2015-12-29,宁夏纪委监察厅网站,"2015年9月，石嘴山市纪委对宁夏精细化工基地党工委原书记龚明科严重违纪问题进行了立案审查。,经查，龚明科在任平罗县交通局局长、宁夏平罗工业园区和石嘴山生态经济开发区党工委书记期间，严重违反廉洁纪律，利用职务上的便利为他人谋取利益并收受财物，收受礼金、礼品，向公务人员赠送礼金；严重违反财经纪律，虚列项目骗取国家财政拨款，设立“小金库”。其中，利用职务上的便利为他人谋取利益并收受财物，虚列项目骗取国家财政拨款，设立“小金库”问题涉嫌犯罪。,龚明科身为平罗县委委员，理想信念丧失，严重违反党的纪律，性质恶劣，情节严重。依据《中国共产党纪律处分条例》等有关规定，经石嘴山市纪委常委会议审议，并报石嘴山市委常委会议批准，2015年12月平罗县委常委会议研究决定，给予龚明科开除党籍、开除公职处分。给予其开除党籍的处分，待召开中共平罗县委员会全体会议时予以追认；收缴其违纪所得将其涉嫌犯罪问题、线索及所涉款物移送司法机关依法处理。（石嘴山市纪委）"
http://www.nxjjjc.gov.cn/jlsc/qn/201512/t20151229_3523564.html,惠农区发改局原局长李占军严重违纪被开除党籍和公职,2015-12-29,宁夏纪委监察厅网站,"2015年6月，石嘴山市纪委对惠农区发改局原局长李占军严重违纪问题进行了立案审查。,经查，李占军在任惠农区交通局局长、发改局局长期间，严重违反廉洁纪律，利用职务上的便利为他人谋取利益并收受财物，收受礼金、礼品，为亲友经营活动谋取利益，向公务人员赠送礼金。其中，利用职务上的便利为他人谋取利益，收受财物问题涉嫌犯罪。,李占军身为惠农区委委员，理想信念丧失，严重违反党的纪律，且党的十八大后仍不收敛、不收手，性质恶劣，情节严重。依据《中国共产党纪律处分条例》等有关规定，经石嘴山市纪委常委会议审议，并报石嘴山市委常委会议批准，2015年12月惠农区委常委会议研究决定，给予李占军开除党籍处分，待召开中共惠农区委员会全体会议时予以追认；惠农区监察局报惠农区人民政府批准，给予其开除公职处分；收缴其违纪所得将其涉嫌犯罪问题、线索及所涉款物移送司法机关依法处理。（石嘴山市纪委）"
http://www.nxjjjc.gov.cn/jlsc/qn/201601/t20160105_3526317.html,黄河农村商业银行原副行长、党委委员贺立仁被开除党籍,2016-01-05,宁夏纪委监察厅网站,"黄河农村商业银行原副行长,党委委员贺立仁被开除党籍,日前，宁夏回族自治区纪委对黄河农村商业银行原副行长、党委委员贺立仁严重违纪问题进行了立案审查。,经查，贺立仁严重违反廉洁纪律，利用职务上的便利为他人谋取利益并收受财物，收受礼金。其中，利用职务上的便利为他人谋取利益，收受财物问题涉嫌犯罪。,贺立仁作为党的领导干部，严重违反党的纪律，且党的十八大后仍不收敛、不收手，性质恶劣、情节严重。根据《中国共产党纪律处分条例》有关规定，经自治区纪委常委会议研究，并报自治区党委常委会议批准，决定给予贺立仁开除党籍处分；由黄河农村商业银行按规定解除贺立仁劳动合同；收缴其违纪所得；将其涉嫌犯罪问题、线索及所涉款物移送司法机关依法处理。"
http://www.nxjjjc.gov.cn/jlsc/qn/201602/t20160216_3546343.html,银川市西夏区委原副书记、原区长李维国被开除党籍和公职,2016-02-16,宁夏纪委监察厅网站,"日前，宁夏回族自治区纪委对银川市西夏区委原副书记、原区长李维国严重违纪问题进行了立案审查。,经查，李维国严重违反政治纪律，对抗组织审查；严重违反组织纪律，不按规定如实报告个人有关事项，在组织约谈时不如实向组织说明问题；严重违反廉洁纪律，利用职务上的便利为他人谋取利益并收受财物，收受礼金，违反有关规定从事营利活动；严重违反生活纪律，长期与他人保持不正当性关系。其中，利用职务上的便利为他人谋取利益，收受财物问题涉嫌犯罪。,李维国身为党员领导干部，严重违反党的纪律，且党的十八大后仍不收敛、不收手，性质恶劣、情节严重。根据《中国共产党纪律处分条例》有关规定，经自治区纪委常委会议研究，并报自治区党委常委会议批准，决定给予李维国开除党籍处分；由自治区监察厅报自治区人民政府批准，给予其行政开除处分；由自治区人大常委会依法罢免其自治区、银川市、西夏区人大代表职务；收缴其违纪所得；将其涉嫌犯罪问题、线索及所涉款物移送司法机关依法处理。"
http://www.nxjjjc.gov.cn/jlsc/qn/201602/t20160216_3546342.html,青铜峡市委原副书记、原市长张国彦被开除党籍和公职,2016-02-16,宁夏纪委监察厅网站,"日前，宁夏回族自治区纪委对,青铜峡市委原副书记,原市长张国彦,严重违纪问题进行了立案审查。,经查，,张国彦,严重违反廉洁纪律，利用职务上的便利为他,人谋取利益,并收受财物，,为谋取本人职务升迁给予有关人员财物,。其问题,已,涉嫌犯罪。,张国彦,身为党员,领导干部，严重违反党的纪律,根据《中国共产党纪律处分条例》有关规定，,经自治区纪委常委会议研究，并报自治区党委常委会议批准，决定给予,张国彦,开除党籍处分；,由自治区监察厅报自治区人民政府批准，,给予其,行政,开除处分；,由,自治区人大,常委会,依法罢免其,自治区、吴忠市、青铜峡市,人大代表职务；,将,其涉嫌犯罪问题、线索及,所涉,款物移送司法机关依法处理。"
http://www.nxjjjc.gov.cn/jlsc/qn/201604/t20160419_4026515.html,宁夏建工集团有限公司党委委员、副总经理刘文秀接受组织调查,2016-04-19,宁夏纪委监察厅网站,"宁夏建工集团有限公司党委委员,副总经理刘文秀接受组织调查,宁夏建工集团有限公司党委委员、副总经理刘文秀涉嫌严重违纪，目前正接受组织调查。"
http://www.nxjjjc.gov.cn/jlsc/qn/201604/t20160419_4026517.html,宁夏商务厅党组书记、副厅长、自治区博览局局长王静接受组织调查,2016-04-19,宁夏纪委监察厅网站,"自治区商务厅党组书记、副厅长、,自治区博览局局长王静,接受组织调查,宁夏回族,自治区商务厅党组书记、副厅长、自治区博览局局长王静,涉,嫌严重违纪，目前正接受组织调查。"
http://www.nxjjjc.gov.cn/jlsc/qn/201503/t20150316_3364227.html,高重瞳、马林国涉嫌严重违纪正接受组织调查,2014-04-21,宁夏纪委监察厅网站,宁夏回族自治区经信委副主任高重瞳、宁夏电力公司银川市供电局局长马林国（副厅级）涉嫌严重违纪，目前正接受组织调查。（宁夏区纪委）
http://www.nxjjjc.gov.cn/jlsc/qn/201503/t20150316_3364235.html,银川供电公司原总经理马林国被开除党籍,2014-07-08,宁夏纪委监察厅网站,"日前，宁夏回族自治区纪委对国网宁夏电力公司银川供电公司原总经理马林国严重违纪问题进行了立案审查。,经查，马林国利用职务上的便利为他人谋取利益，收受贿赂、贪污公款，并违反廉洁自律规定。,马林国的行为已构成严重违纪，并涉嫌违法犯罪。根据《中国共产党纪律处分条例》有关规定，经自治区纪委常委会研究，并报自治区党委批准，决定给予马林国开除党籍处分；由国网宁夏电力公司给予其行政开除处分；收缴其违纪所得；将其涉嫌犯罪问题及线索移送司法机关依法处理。"
http://www.nxjjjc.gov.cn/jlsc/qn/201503/t20150316_3364236.html,宁夏检察院依法决定对马林国高重瞳黄全福立案侦查,2014-07-22,宁夏日报,"7月21日，记者从宁夏回族自治区人民检察院获悉，该院日前决定依法对马林国、高重瞳、黄全福立案侦查。,自治区人民检察院决定，依法对国网宁夏电力公司银川供电公司原总经理马林国(副厅级)涉嫌受贿罪、贪污罪立案侦查，并采取强制措施。依法对自治区经济和信息化委员会原副主任高重瞳(副厅级)涉嫌受贿犯罪立案侦查，并采取强制措施。依法对自治区农牧厅原巡视员黄全福(正厅级)涉嫌受贿犯罪立案侦查，并采取强制措施。目前，三案侦查工作正在进行中。 (记者 乔素华 实习生 张钰)"
http://www.nxjjjc.gov.cn/jlsc/qn/201503/t20150316_3364228.html,宁夏食药监管局党组成员黄继红接受组织调查,2014-08-04,宁夏纪委监察厅网站,宁夏回族自治区食品药品监督管理局党组成员、派驻纪检组长黄继红涉嫌严重违纪，目前正接受组织调查。（宁夏回族自治区纪委）
http://www.nxjjjc.gov.cn/jlsc/qn/201503/t20150316_3364229.html,宁夏国资委原主任黄宗信接受组织调查,2014-08-04,宁夏纪委监察厅网站,宁夏回族自治区国资委原主任黄宗信涉嫌严重违纪，目前正接受组织调查。（宁夏回族自治区纪委）
http://www.nxjjjc.gov.cn/jlsc/qn/201511/t20151109_3501439.html,黄宗信黄继红杜迁被开除党籍,2014-11-18,宁夏纪委监察厅网站,"日前，宁夏回族自治区纪委对,自治区第十一届党委委员、国资委原主任黄宗信，自治区食品药品监督管理局党组成员、派驻纪检组长黄继红，,平罗县县委书记杜迁严重违纪问题进行了立案调查。,经查，黄宗信、黄继红、杜迁利用职务上的便利，为有关企业和个人谋取利益，收受贿赂，接受礼品、礼金，其行为已构成严重违纪，并涉嫌违法犯罪。根据《中国共产党纪律处分条例》和《行政机关公务员处分条例》有关规定，,经自治区纪委常委会议研究，自治区党委常委会议同意，报中央纪委审议，并经中共中央批准，,决定给予黄宗信开除党籍处分；,经自治区纪委常委会议研究，并报自治区党委常委会议批准，,决定给予黄继红开除党籍处分，由自治区人民政府给予其行政开除处分；由石嘴山市委给予杜迁开除党籍、开除公职处分，并依法罢免其三级人大代表职务；收缴黄宗信、黄继红、杜迁违纪所得，将其涉嫌犯罪问题及线索移送司法机关依法处理。"
http://www.nxjjjc.gov.cn/jlsc/qn/201510/t20151029_3496516.html,平罗县人民医院院长褚维海涉嫌严重违纪接受组织调查,2014-12-05,宁夏纪委监察厅网站,据石嘴山市纪委消息：平罗县人民医院院长褚维海，涉嫌严重违纪，目前正接受组织调查。
http://www.nxjjjc.gov.cn/jlsc/qn/201503/t20150316_3364230.html,宁夏公安厅副厅长贾奋强、交通运输厅副厅长杨有明接受组织调查,2014-12-05,宁夏纪委监察厅网站,"宁夏回族自治区公安厅副厅长贾奋强,交通运输厅副厅长杨有明接受组织调查,日前，经宁夏回族自治区党委同意，宁夏回族自治区纪委对自治区公安厅党委委员、副厅长贾奋强，自治区交通运输厅党组成员、副厅长杨有明涉嫌严重违纪问题进行立案调查。"
http://www.nxjjjc.gov.cn/jlsc/qn/201503/t20150316_3364231.html,周金柱涉嫌严重违纪接受组织调查,2015-01-05,宁夏纪委监察厅网站,经宁夏回族自治区党委批准，宁夏回族自治区信息化建设办公室副主任周金柱（副厅级）涉嫌严重违纪，目前正接受组织调查。
http://www.nxjjjc.gov.cn/jlsc/qn/201511/t20151103_3498608.html,中卫市商务和经济合作局原副局长冯建平严重违纪违法被开除党籍,2015-01-23,宁夏纪委监察厅网站,"据中卫市纪委消息：日前，中卫市纪委对中卫市商务和经济合作局原党组成员、副局长冯建平涉嫌严重违纪违法问题进行立案审查。,根据《中国共产党纪律处分条例》的有关规定，中卫市纪委、中卫市监察局分别给予冯建平开除党籍、开除公职处分，同时，将其涉嫌犯罪问题移送司法机关依法处理。"
http://www.nxjjjc.gov.cn/jlsc/qn/201503/t20150316_3364224.html,宁夏公安厅副厅长贾奋强、宁夏交通厅副厅长杨有明被“双开”,2015-02-28,宁夏纪委监察厅网站,"宁夏公安厅副厅长贾奋强,、宁夏交通厅副厅长杨有明被“双开”,日前，,宁夏回族自治区纪委,对自治区公安厅党委委员、副厅长贾奋强，自治区交通运输厅党委委员、副厅长杨有明涉嫌严重违纪问题进行了立案审查。,经查，贾奋强利用职务上的便利，为有关企业和个人谋取利益，收受贿赂；接受礼金、贵重物品；违反中央八项规定精神。杨有明利用职务上的便利，为有关企业和个人谋取利益，收受贿赂；贪污公款；接受礼金。贾奋强、杨有明的行为已构成严重违纪，并涉嫌违法犯罪。,根据《中国共产党纪律处分条例》和《行政机关公务员处分条例》有关规定，,经自治区纪委常委会议研究，并报自治区党委常委会议批准，,决定给予贾奋强、杨有明开除党籍处分；,经自治区监察厅研究，并报,自治区人民政府批准，决定给予贾奋强、杨有明行政开除处分；由自治区人大常委会依法罢免贾奋强两级人大代表职务；收缴贾奋强、杨有明违纪所得；将其涉嫌犯罪问题及线索移送司法机关依法处理。"
http://www.nxjjjc.gov.cn/jlsc/qn/201510/t20151029_3496519.html,平罗县人民医院院长褚维海严重违纪被“双开”,2015-02-04,宁夏纪委监察厅网站,"据石嘴山市纪委消息：,日前，石嘴山市纪委对,平罗县人民医院院长,褚伟海,严重违纪问题进行了立案审查。经查，,褚伟海利用职务上的便利为他人谋取利益，多次收受贿赂，,已构成严重违纪，并涉嫌违法犯罪。,经石嘴山市纪委常委会审议，平罗县纪委,常委会议研究，并报平罗县委常委会议批准，决定给予褚伟海开除党籍、开除公职处分,；收缴其违纪所得；其涉嫌犯罪问题、线索及涉嫌违法所得款物移送司法机关依法处理。"
http://www.nxjjjc.gov.cn/lzdt/201503/t20150317_3365575.html,仇旭辉涉嫌严重违纪接受组织调查,2015-03-17,宁夏纪委监察厅网站,宁夏回族自治区经济和信息化委员会党组成员、总经济师仇旭辉（副厅级）涉嫌严重违纪，目前正接受组织调查。
http://www.nxjjjc.gov.cn/jlsc/qn/201504/t20150410_3382299.html,宁夏黄河农村商业银行原副行长、党委委员郑新平接受组织调查,2015-04-09,宁夏纪委监察厅网站,据宁夏回族自治区纪委消息：宁夏回族自治区黄河农村商业银行原副行长、党委委员郑新平涉嫌严重违纪，目前正接受组织调查。
http://www.nxjjjc.gov.cn/jlsc/qn/201511/t20151103_3498610.html,中卫市农牧局原副调研员丁志和严重违纪违法被开除党籍,2015-04-28,宁夏纪委监察厅网站,"据中卫市纪委消息：日前，中卫市纪委对中卫市农牧局原副调研员丁志和严重违纪违法问题进行立案审查。,根据《中国共产党纪律处分条例》的有关规定，中卫市纪委于给予丁志和开除党籍处分，建议市人大常委会依法罢免其中卫市第三届人大代表职务，同时，将其涉嫌犯罪问题移送司法机关依法处理。"
http://www.nxjjjc.gov.cn/jlsc/qn/201511/t20151103_3498611.html,中卫市沙坡头区农牧科技局原局长马学峰严重违纪违法被开除党籍,2015-04-28,宁夏纪委监察厅网站,"据中卫市纪委消息：日前，中卫市纪委对中卫市农牧局原副调研员马学峰严重违纪违法问题进行立案审查。,根据《中国共产党纪律处分条例》的有关规定，中卫市纪委、中卫市监察局给予马学峰开除党籍、开除公职处分。同时将涉嫌犯罪问题移送司法机关依法处理。"
http://www.nxjjjc.gov.cn/jlsc/qn/201505/t20150504_3398175.html,宁夏银川市委常委夏夕云、吴忠市委常委张兴斌、宁夏农垦集团有限公司总经理、党委副书记常利民接受组织调查,2015-05-04,宁夏纪委监察厅网站,宁夏回族自治区银川市委常委夏夕云、吴忠市委常委张兴斌、宁夏农垦集团有限公司总经理、党委副书记常利民涉嫌严重违纪，目前正接受组织调查。
http://www.nxjjjc.gov.cn/jlsc/qn/201507/t20150706_3436775.html,宁夏住房和城乡建设厅原副厅长、党组成员、人防办原主任马占林接受组织调查,2015-07-06,宁夏纪委监察厅网站,宁夏回族自治区住房和城乡建设厅原副厅长、党组成员、人防办原主任马占林涉嫌严重违纪，目前正接受组织调查。
http://www.nxjjjc.gov.cn/jlsc/qn/201511/t20151110_3501788.html,"银川市房改办原调研员、副主任李平被""双开""",2015-07-28,宁夏纪委监察厅网站,"据银川市纪委消息：日前，经中共银川市委批准，银川市纪委对银川市房改办原调研员、副主任李平严重违纪问题进行了立案审查。,经查，李平在担任银川市房改办副主任期间，未认真履行职责造成房改房维修资金,700,余万元重大损失；利用职务上的便利，收受贿赂,20,万元。已构成严重违纪，并涉嫌违法犯罪。依据《中国共产党纪律处分条例》、《行政机关公务员处分条例》等有关规定，经中共银川市纪委常委会、监察局局长办公会议研究，并报经中共银川市委、银川市人民政府批准，决定给予李平开除党籍、行政开除处分；收缴其违纪所得；将其涉嫌犯罪问题、线索及涉嫌违法所得移送司法机关依法处理。"
http://www.nxjjjc.gov.cn/jlsc/qn/201503/t20150325_3370876.html,银川上前城检察院肖瑞田严重违纪违法移交检察院纪检组立案调查,2013-12-05,宁夏纪委监察厅网站,"据银川市纪委消息：,2013年,12,月,5,日，银川市纪委将上前城检察院主任科员肖瑞田严重违纪违法问题移交市检察院纪检组进行立案调查。,经查，肖瑞田存在收受贿赂的违纪违法问题。对肖瑞田违纪违法问题处理结果：给予肖瑞田开除党籍、行政开除处分。司法机关判处有期徒刑二年，并处罚金,10000元。"
http://www.nxjjjc.gov.cn/jlsc/qn/201503/t20150324_3370852.html,银川高新技术产业开发区管委会主任助理方仁严重违纪被开除党籍和公职,2013-12-21,宁夏纪委监察厅网站,"日前，宁夏回族自治区纪委对银川经济技术开发区原党工委委员、主任助理方仁严重违纪问题进行了立案检查。,经查，方仁利用职务上的便利，为他人谋取利益，收受巨额贿赂；接受他人礼金、礼品。经自治区纪委审议，报自治区党委批准，决定给予方仁开除党籍处分，并由有关部门给予其行政开除处分；收缴其违纪所得；将其涉嫌犯罪问题及犯罪问题线索移送司法机关依法处理。"
http://www.nxjjjc.gov.cn/jlsc/qn/201503/t20150325_3370877.html,中卫商务和经济合作局副局长冯建平违纪违法被立案调查,2014-01-14,宁夏纪委监察厅网站,"据中卫市纪委消息：2014年1月14日，中卫市纪委对中卫市商务和经济合作局副局长冯建平违纪违法问题进行立案调查。,经查，冯建平存在贪污公款20万元的违纪违法问题。中卫市纪委监察局给予冯建平开除党籍、开除公职处分，中卫市中级人民法院依法判处其有期徒刑11年。"
http://www.nxjjjc.gov.cn/jlsc/qn/201503/t20150325_3370878.html,中宁住建局副局长戴治宁违纪违法被立案调查,2014-03-20,宁夏纪委监察厅网站,"据中卫市中宁县纪委消息：,2014年,3,月,20,日，中卫市中宁县纪委对中宁县住房和城乡建设局副局长戴治宁违纪违法问题进行立案调查。,经查，戴治宁存在利用职务便利，非法收受他人财物共计7.89万元的违纪违法问题。中宁县给予戴治宁开除党籍、开除公职处分，中卫市中级人民法院依法判处其有期徒刑三年。"
http://www.nxjjjc.gov.cn/jlsc/qn/201503/t20150325_3370881.html,红寺堡原区委常委、宣传部长高锐严重违纪违法被立案调查,2014-07-25,宁夏纪委监察厅网站,"据吴忠市纪委消息：吴忠市纪委对红寺堡区原区委常委、宣传部长高锐严重违纪违法问题进行立案调查。,经查，高锐存在严重违纪违法问题，对高锐严重违纪违法问题处理结果：经吴忠市委、市人民政府批准，决定给予高锐开除党籍、开除公职处分。,2014,年７月，吴忠市利通区人民法院因高锐犯受贿罪、贪污罪，被判处有期徒刑六年。"
http://www.nxjjjc.gov.cn/jlsc/qn/201503/t20150325_3370882.html,银川职业技术学院党委委员、副书记、常务副校长张秀芹严重违纪违法被立案调查,2014-08-05,宁夏纪委监察厅网站,"据银川市纪委消息：,2014年,8,月,5,日，银川市纪委对银川市职业技术学院党委委员、副书记、常务副校长张秀芹严重违纪违法问题进行立案调查。,经查，张秀芹存在违反财经纪律、收受贿赂等违纪违法问题。对张秀芹违纪违法问题处理结果：给予张秀芹开除党籍处分，收缴违纪所得，按规定建议撤销其两级政协委员资格，移送司法机关。"
http://www.nxjjjc.gov.cn/jlsc/qn/201503/t20150325_3370883.html,沙坡头柔远镇柔远村出纳周建华违纪违法被立案调查,2014-10-10,宁夏纪委监察厅网站,"据中卫市沙坡头区纪工委消息，2014年10月10日，中卫市沙坡头区纪工委对沙坡头区柔远镇柔远村出纳周建华违纪违法问题进行立案调查。,经查，周建华存在利用职务便利，挪用公款32万元的违纪违法问题。沙坡头区纪工委给予周建华开除党籍处分，沙坡头区人民法院依法判处其有期徒刑3年，缓刑4年。"
